133,235132094,"如題！聽說李福鐘教授的考題都很detail⋯⋯
有沒有好心人拯救一下🥺祝大家期末歐趴歐趴！",求四78台灣電影史期末的考古題🥲,2021-01-07T14:31:41.762Z,2021-01-07T14:31:41.762Z,4,6,F,nccu,https://www.dcard.tw/f/nccu/p/235132094,dcard,post,如題聽說李福鐘教授的考題都很有沒有好心人拯救一下祝大家期末歐趴歐趴,"['如', '題', '聽說', '李福', '鐘', '教授', '的', '考題', '都', '很', '有沒有', '好心人', '拯救', '一下', '祝', '大家', '期末', '歐', '趴', '歐', '趴']","['題', '聽說', '李福', '鐘', '教授', '考題', '有沒有', '好心人', '拯救', '一下', '祝', '期末', '歐', '趴', '歐', '趴']",[],neutral
134,235132088,"如題 我今年學測考完以為自己會很有興趣唸
以及抱著挑戰自己的心態
進到社科院某個大二大三有xx食物的系
但唸到現在發現跟當初預想的落差太多
在系上也沒有碰到志同道合的朋友
實在沒什麼動力繼續唸
每一堂課都快待不下去了
所以萌生了轉系的想法
目前最想轉進的是教育系
當初學測也有填 確定自己會喜歡 也有個執教的夢
但教育系下學期的課似乎都沒有開放外系生
（已查過課程查詢系統）
這樣還有辦法在下學期先接觸教育系的課程嗎
以及這樣會影響到轉系成功的機率嗎 如果下學期沒辦法上到教育系的課的話
因為我真的真的蠻想轉進去的
很難有勸退我的方法
然後最後一個問題想問成功轉系到教育系的學長姐
就是成功機率高嗎 雖然問題很籠統
不過我現在應該注意什麼 目前成績應該不算太差
希望能夠獲得解答了 感謝🙏",教育系轉系請益,2021-01-07T14:30:49.759Z,2021-01-07T14:30:49.759Z,27,11,M,nccu,https://www.dcard.tw/f/nccu/p/235132088,dcard,post,如題我今年學測考完以為自己會很有興趣唸以及抱著挑戰自己的心態進到社科院某個大二大三有食物的系但唸到現在發現跟當初預想的落差太多在系上也沒有碰到志同道合的朋友實在沒什麼動力繼續唸每一堂課都快待不下去了所以萌生了轉系的想法目前最想轉進的是教育系當初學測也有填確定自己會喜歡也有個執教的夢但教育系下學期的課似乎都沒有開放外系生已查過課程查詢系統這樣還有辦法在下學期先接觸教育系的課程嗎以及這樣會影響到轉系成功的機率嗎如果下學期沒辦法上到教育系的課的話因為我真的真的蠻想轉進去的很難有勸退我的方法然後最後一個問題想問成功轉系到教育系的學長姐就是成功機率高嗎雖然問題很籠統不過我現在應該注意什麼目前成績應該不算太差希望能夠獲得解答了感謝,"['如', '題', '我', '今年', '學測', '考完', '以為', '自己', '會', '很', '有', '興趣', '唸', '以及', '抱', '著', '挑戰', '自己', '的', '心態', '進到', '社科院', '某', '個', '大二', '大三', '有', '食物', '的', '系', '但', '唸到', '現在', '發現', '跟', '當初', '預想', '的', '落差', '太多', '在', '系', '上', '也', '沒有', '碰到', '志同道合', '的', '朋友', '實在', '沒', '什麼', '動力', '繼續', '唸', '每', '一', '堂', '課', '都', '快', '待', '不', '下去', '了', '所以', '萌生', '了', '轉系', '的', '想法', '目前', '最', '想', '轉進', '的', '是', '教育系', '當初', '學測', '也', '有', '填', '確定', '自己', '會', '喜歡', '也', '有', '個', '執教', '的', '夢', '但', '教育系', '下', '學期', '的', '課', '似乎', '都', '沒有', '開放', '外系', '生', '已', '查', '過', '課程', '查詢', '系統', '這樣', '還', '有', '辦法', '在下', '學期', '先', '接觸', '教育系', '的', '課程', '嗎', '以及', '這樣', '會', '影響到', '轉系', '成功', '的', '機率', '嗎', '如果', '下', '學期', '沒辦法', '上到', '教育系', '的', '課', '的', '話', '因為', '我', '真的', '真的', '蠻', '想', '轉進', '去', '的', '很', '難', '有', '勸退', '我', '的', '方法', '然後', '最後', '一', '個', '問題', '想', '問', '成功', '轉系', '到', '教育系', '的', '學長', '姐', '就是', '成功', '機率', '高', '嗎', '雖然', '問題', '很', '籠統', '不過', '我', '現在', '應該', '注意', '什麼', '目前', '成績', '應該', '不', '算', '太', '差', '希望', '能夠', '獲得', '解答', '了', '感謝']","['題', '今年', '學測', '考完', '以為', '興趣', '唸', '抱', '挑戰', '心態', '進到', '社科院', '大二', '大三', '食物', '系', '唸到', '現在', '發現', '當初', '預想', '落差', '太多', '系', '碰到', '志同道合', '朋友', '實在', '動力', '繼續', '唸', '堂', '課', '下去', '萌生', '轉系', '想法', '目前', '最', '想', '轉進', '教育系', '當初', '學測', '填', '確定', '喜歡', '執教', '夢', '教育系', '下', '學期', '課', '似乎', '開放', '外系', '生', '已', '查', '課程', '查詢', '系統', '辦法', '學期', '先', '接觸', '教育系', '課程', '影響到', '轉系', '成功', '機率', '下', '學期', '沒辦法', '上到', '教育系', '課', '話', '真的', '真的', '想', '轉進', '難', '勸退', '方法', '最後', '問題', '想', '問', '成功', '轉系', '教育系', '學長', '姐', '成功', '機率', '高', '問題', '籠統', '現在', '應該', '注意', '目前', '成績', '應該', '算', '太', '差', '希望', '能夠', '獲得', '解答', '感謝']","['教育系', '課', '轉系']",positive
135,235131993,"如題，去年因為輔系高標準的關係沒過門檻，
這學期簽重複修習單之後重來一次，但修到一半高標準就被廢除惹 修ㄌ個寂寞...
想請問這樣我這學期這門課的學分會列入gpa嗎
（本來以為是0學分，但剛剛看選課系統還是寫3）
感謝大啊 期中嗨趴",重複修習會列入gpa嗎,2021-01-07T14:16:34.911Z,2021-01-07T14:19:38.222Z,3,4,F,nccu,https://www.dcard.tw/f/nccu/p/235131993,dcard,post,如題去年因為輔系高標準的關係沒過門檻這學期簽重複修習單之後重來一次但修到一半高標準就被廢除惹修個寂寞想請問這樣我這學期這門課的學分會列入嗎本來以為是學分但剛剛看選課系統還是寫感謝大啊期中嗨趴,"['如', '題', '去年', '因', '為輔系', '高標準', '的', '關係', '沒', '過', '門檻', '這', '學期', '簽', '重複', '修習單', '之後', '重來', '一', '次', '但', '修到', '一半', '高標準', '就', '被', '廢除', '惹修', '個', '寂寞', '想', '請問', '這樣', '我', '這', '學期', '這', '門', '課', '的', '學分', '會', '列入', '嗎', '本來', '以為', '是', '學分', '但', '剛剛', '看', '選課', '系統', '還是', '寫', '感謝', '大', '啊', '期中', '嗨', '趴']","['題', '去年', '為輔系', '高標準', '關係', '門檻', '學期', '簽', '重複', '修習單', '之後', '重來', '次', '修到', '一半', '高標準', '廢除', '惹修', '寂寞', '想', '請問', '學期', '門', '課', '學分', '列入', '本來', '以為', '學分', '剛剛', '選課', '系統', '寫', '感謝', '期中', '嗨', '趴']",[],negative
136,235131518,"https://i.imgur.com/IKLCc4Y.jpg
我覺得是B跟A啦
是這樣嗎？
尤其第二題的B 法碩也ok(?
大家怎麼看",英美導(廖)練習題,2021-01-07T13:08:43.562Z,2021-01-07T13:08:43.562Z,5,4,F,nccu,https://www.dcard.tw/f/nccu/p/235131518,dcard,post,我覺得是跟啦是這樣嗎尤其第二題的法碩也大家怎麼看,"['我', '覺得', '是', '跟', '啦', '是', '這樣', '嗎', '尤其', '第二', '題', '的', '法碩', '也', '大家', '怎麼', '看']","['覺得', '尤其', '第二', '題', '法碩']",[],neutral
137,235131450,"我的雨傘是一把全黑的自動傘 握把底部是金色的
今天下午四點下課進總圖
我收起來但沒有把傘把壓下去 而是讓它靠著牆壁
今天晚上七點出去 發現雨傘壞掉了
自動傘要先把傘把壓下去才能打開 但發現沒辦法自然壓下去
花很大的力氣壓下去後 傘沒辦法正常打開 露出一段線
不知道是不是有同學以為是他的傘
然後沒有依自動傘的正常開合 而是直接撐開後又收回
發現不是自己的傘後又放回

如果留個紙條讓我知道 我還不會這麼難過
無預警的看到雨傘壞掉真的很心痛
不是因為有多貴 而是珍惜很久的東西就這樣壞了
沒有想到雨傘放在總圖外面會壞掉
希望同學如果弄壞別人的東西可以貼過紙條告知
或許也是那個人沒想到雨傘會因為這樣就壞掉了
我想我也有錯 應該要完全收好然後放在箱子裡面

發這篇文只是想抒發 真的好難過嗚嗚
如果不妥再告知 我再刪除
希望大家都保護好自己的傘也不要被偷
天氣很冷要記得保暖不要感冒了
大家期末加油",放總圖外的雨傘被用壞,2021-01-07T12:58:52.735Z,2021-01-07T13:08:53.524Z,11,11,F,nccu,https://www.dcard.tw/f/nccu/p/235131450,dcard,post,我的雨傘是一把全黑的自動傘握把底部是金色的今天下午四點下課進總圖我收起來但沒有把傘把壓下去而是讓它靠著牆壁今天晚上七點出去發現雨傘壞掉了自動傘要先把傘把壓下去才能打開但發現沒辦法自然壓下去花很大的力氣壓下去後傘沒辦法正常打開露出一段線不知道是不是有同學以為是他的傘然後沒有依自動傘的正常開合而是直接撐開後又收回發現不是自己的傘後又放回如果留個紙條讓我知道我還不會這麼難過無預警的看到雨傘壞掉真的很心痛不是因為有多貴而是珍惜很久的東西就這樣壞了沒有想到雨傘放在總圖外面會壞掉希望同學如果弄壞別人的東西可以貼過紙條告知或許也是那個人沒想到雨傘會因為這樣就壞掉了我想我也有錯應該要完全收好然後放在箱子裡面發這篇文只是想抒發真的好難過嗚嗚如果不妥再告知我再刪除希望大家都保護好自己的傘也不要被偷天氣很冷要記得保暖不要感冒了大家期末加油,"['我', '的', '雨傘', '是', '一', '把', '全', '黑', '的', '自動傘', '握', '把', '底部', '是', '金色', '的', '今天', '下午', '四點', '下課', '進', '總圖', '我', '收起', '來', '但', '沒有', '把', '傘', '把', '壓下去', '而是', '讓', '它', '靠', '著', '牆壁', '今天', '晚上', '七點', '出去', '發現', '雨傘', '壞掉', '了', '自動傘', '要', '先', '把', '傘', '把', '壓下去', '才能', '打開', '但', '發現', '沒辦法', '自然', '壓下去', '花', '很', '大', '的', '力氣', '壓下去', '後', '傘', '沒辦法', '正常', '打開', '露出', '一段線', '不', '知道', '是', '不', '是', '有', '同學', '以為', '是', '他', '的', '傘', '然後', '沒有', '依', '自動傘', '的', '正常', '開合', '而是', '直接', '撐開', '後', '又', '收回', '發現', '不', '是', '自己', '的', '傘', '後', '又', '放回', '如果', '留', '個', '紙條', '讓', '我', '知道', '我', '還', '不會', '這麼', '難過', '無', '預警', '的', '看到', '雨傘', '壞掉', '真的', '很', '心痛', '不', '是', '因為', '有', '多', '貴', '而是', '珍惜', '很', '久', '的', '東西', '就', '這樣', '壞', '了', '沒有', '想到', '雨傘', '放', '在', '總圖', '外面', '會', '壞掉', '希望', '同學', '如果', '弄壞', '別人', '的', '東西', '可以', '貼', '過', '紙條', '告知', '或許', '也', '是', '那', '個', '人', '沒想到', '雨傘', '會', '因為', '這樣', '就', '壞掉', '了', '我', '想', '我', '也', '有', '錯', '應該', '要', '完全', '收好', '然後', '放', '在', '箱子', '裡面', '發', '這', '篇', '文', '只是', '想', '抒發', '真的', '好', '難過', '嗚嗚', '如果', '不妥', '再', '告知', '我', '再', '刪除', '希望', '大家', '都', '保護', '好', '自己', '的', '傘', '也', '不要', '被', '偷', '天氣', '很', '冷', '要', '記得', '保暖', '不要', '感冒', '了', '大家', '期末', '加油']","['雨傘', '全', '黑', '自動傘', '握', '底部', '金色', '今天', '下午', '四點', '下課', '進', '總圖', '收起', '傘', '壓下去', '牆壁', '今天', '晚上', '七點', '發現', '雨傘', '壞掉', '自動傘', '先', '傘', '壓下去', '打開', '發現', '沒辦法', '自然', '壓下去', '花', '力氣', '壓下去', '後', '傘', '沒辦法', '正常', '打開', '露出', '一段線', '知道', '同學', '以為', '傘', '自動傘', '正常', '開合', '直接', '撐開', '後', '收回', '發現', '傘', '後', '放回', '留', '紙條', '知道', '難過', '無', '預警', '看到', '雨傘', '壞掉', '真的', '心痛', '貴', '珍惜', '久', '東西', '壞', '想到', '雨傘', '放', '總圖', '外面', '壞掉', '希望', '同學', '弄壞', '東西', '貼', '紙條', '告知', '人', '沒想到', '雨傘', '壞掉', '想', '錯', '應該', '完全', '收好', '放', '箱子', '裡面', '發', '篇', '文', '想', '抒發', '真的', '好', '難過', '嗚嗚', '不妥', '再', '告知', '再', '刪除', '希望', '保護', '好', '傘', '偷', '天氣', '冷', '記得', '保暖', '感冒', '期末', '加油']","['傘', '雨傘', '壓下去']",negative
138,235131278,https://i.imgur.com/ufjf1oA.jpg如題，有人也收到這封信嗎？為什麼這種外部公司的信可以寄到學校信箱啊？,方選文創的信？,2021-01-07T12:29:23.001Z,2021-01-07T12:29:23.001Z,1,2,F,nccu,https://www.dcard.tw/f/nccu/p/235131278,dcard,post,如題有人也收到這封信嗎為什麼這種外部公司的信可以寄到學校信箱啊,"['如', '題', '有', '人', '也', '收到', '這', '封', '信', '嗎', '為什麼', '這', '種', '外部', '公司', '的', '信', '可以', '寄到', '學校', '信箱', '啊']","['題', '人', '收到', '封', '信', '種', '外部', '公司', '信', '寄到', '學校', '信箱']",[],neutral
139,235130957,"https://i.imgur.com/qYdX5MT.jpg
招募信說1/8報名截止，為什麼現在就顯失表單已暫停受理啊啊？寫信問國合處，未回覆；私訊國合處粉專，竟然被已讀⋯⋯

有人知道原因嗎嗚嗚",buddy program 無法報名,2021-01-07T11:38:37.461Z,2021-01-07T11:40:21.160Z,5,4,M,nccu,https://www.dcard.tw/f/nccu/p/235130957,dcard,post,招募信說報名截止為什麼現在就顯失表單已暫停受理啊啊寫信問國合處未回覆私訊國合處粉專竟然被已讀有人知道原因嗎嗚嗚,"['招募', '信說', '報名', '截止', '為什麼', '現在', '就', '顯', '失', '表單', '已', '暫停', '受理', '啊', '啊', '寫信', '問', '國合處', '未', '回覆', '私訊國合處粉', '專', '竟然', '被', '已', '讀', '有', '人', '知道', '原因', '嗎', '嗚嗚']","['招募', '信說', '報名', '截止', '現在', '顯', '失', '表單', '已', '暫停', '受理', '寫信', '問', '國合處', '未', '回覆', '私訊國合處粉', '專', '已', '讀', '人', '知道', '原因', '嗚嗚']",[],negative
140,235130684,"會計入選課點數的只有教學意見調查是吧
還是助教的意見調查也要填
拜託知道的解答偶的疑惑",選課點數 問題,2021-01-07T10:50:41.525Z,2021-01-07T10:50:41.525Z,6,9,F,nccu,https://www.dcard.tw/f/nccu/p/235130684,dcard,post,會計入選課點數的只有教學意見調查是吧還是助教的意見調查也要填拜託知道的解答偶的疑惑,"['會計', '入選', '課', '點數', '的', '只有', '教學', '意見', '調查', '是', '吧', '還是', '助教', '的', '意見', '調查', '也', '要', '填', '拜託', '知道', '的', '解答', '偶', '的', '疑惑']","['會計', '入選', '課', '點數', '教學', '意見', '調查', '助教', '意見', '調查', '填', '拜託', '知道', '解答', '偶', '疑惑']",[],negative
141,235130377,"如題
因為上學期衝堂所以只能修下學期
今天給教授簽了擋修單
結果他說因為是學年課，如果不把上學期的也修完，下學期的學分就算過了也拿不到
(最後補一句我也不是很清楚啦)

還有這種事??!
讀了四年第一次聽說
拜託告訴我不是真的，差3學分能畢業嗚嗚嗚嗚嗚嗚",學年課只修一學期有學分嗎?,2021-01-07T09:54:19.421Z,2021-01-07T10:37:37.415Z,7,10,F,nccu,https://www.dcard.tw/f/nccu/p/235130377,dcard,post,如題因為上學期衝堂所以只能修下學期今天給教授簽了擋修單結果他說因為是學年課如果不把上學期的也修完下學期的學分就算過了也拿不到最後補一句我也不是很清楚啦還有這種事讀了四年第一次聽說拜託告訴我不是真的差學分能畢業嗚嗚嗚嗚嗚嗚,"['如', '題', '因為', '上', '學期', '衝堂', '所以', '只', '能', '修下', '學期', '今天', '給', '教授', '簽', '了', '擋修單', '結果', '他', '說', '因為', '是', '學年課', '如果', '不', '把', '上', '學期', '的', '也', '修完', '下', '學期', '的', '學分', '就算', '過', '了', '也', '拿不到', '最後', '補', '一', '句', '我', '也', '不', '是', '很', '清楚', '啦', '還', '有', '這', '種', '事', '讀', '了', '四年', '第一', '次', '聽說', '拜託', '告訴', '我', '不', '是', '真的', '差', '學分', '能', '畢業', '嗚嗚', '嗚嗚', '嗚嗚']","['題', '學期', '衝堂', '只', '修下', '學期', '今天', '教授', '簽', '擋修單', '說', '學年課', '學期', '修完', '下', '學期', '學分', '拿不到', '最後', '補', '句', '清楚', '種', '事', '讀', '四年', '第一', '次', '聽說', '拜託', '告訴', '真的', '差', '學分', '畢業', '嗚嗚', '嗚嗚', '嗚嗚']",[],negative
142,235130161,"歐洲政府與外交政策 湯紹成

109(上)期中考
1.請解釋主要矛盾與次要矛盾，並舉例說明

2.德國人民族性和政府特色

3.請在課程範圍內，自訂題目，自由發揮

4.請敘述開課至今的心得感想

109(上)期末考
1.請說明英國政府的政治制度

2.請比較法國與俄羅斯總統的職權

3.請在課程範圍內，自訂題目，自由發揮

4.請敘述開課至今的心得感想

英文作答+20%，不得參考其他資料
考試時間90分鐘，字數不限

看網路上找的考古題很久沒更新
所以發到這裡方便學弟妹們查詢",歐洲政府與外交政策 湯紹成,2021-01-07T09:16:07.463Z,2021-01-07T09:19:10.447Z,8,15,M,nccu,https://www.dcard.tw/f/nccu/p/235130161,dcard,post,歐洲政府與外交政策湯紹成上期中考請解釋主要矛盾與次要矛盾並舉例說明德國人民族性和政府特色請在課程範圍內自訂題目自由發揮請敘述開課至今的心得感想上期末考請說明英國政府的政治制度請比較法國與俄羅斯總統的職權請在課程範圍內自訂題目自由發揮請敘述開課至今的心得感想英文作答不得參考其他資料考試時間分鐘字數不限看網路上找的考古題很久沒更新所以發到這裡方便學弟妹們查詢,"['歐洲', '政府', '與', '外交', '政策', '湯紹成上', '期中考', '請', '解釋', '主要', '矛盾', '與', '次要', '矛盾', '並', '舉例', '說明', '德國人', '民族性', '和', '政府', '特色', '請', '在', '課程', '範圍', '內', '自訂', '題目', '自由', '發揮', '請', '敘述', '開課', '至今', '的', '心得', '感想', '上', '期末考', '請', '說明', '英國', '政府', '的', '政治', '制度', '請', '比較', '法國', '與', '俄羅斯', '總統', '的', '職權', '請', '在', '課程', '範圍', '內', '自訂', '題目', '自由', '發揮', '請', '敘述', '開課', '至今', '的', '心得', '感想', '英文', '作答', '不得', '參考', '其他', '資料', '考試', '時間', '分鐘', '字數', '不', '限', '看', '網路', '上', '找', '的', '考古題', '很', '久', '沒', '更新', '所以', '發到', '這裡', '方便', '學弟妹', '們', '查詢']","['歐洲', '政府', '外交', '政策', '湯紹成上', '期中考', '請', '解釋', '主要', '矛盾', '次要', '矛盾', '舉例', '說明', '德國人', '民族性', '政府', '特色', '請', '課程', '範圍', '自訂', '題目', '自由', '發揮', '請', '敘述', '開課', '至今', '心得', '感想', '期末考', '請', '說明', '英國', '政府', '政治', '制度', '請', '比較', '法國', '俄羅斯', '總統', '職權', '請', '課程', '範圍', '自訂', '題目', '自由', '發揮', '請', '敘述', '開課', '至今', '心得', '感想', '英文', '作答', '參考', '資料', '考試', '時間', '分鐘', '字數', '限', '網路', '找', '考古題', '久', '更新', '發到', '這裡', '方便', '學弟妹', '查詢']",[],positive
143,235129955,"有上課的大家知道怎麼寫嗎？？
我有上課，但實在不知道那些東西怎麼應用在企業轉型欸🤦🏻‍♂️",計算思維 作業,2021-01-07T08:40:00.601Z,2021-01-07T08:40:00.601Z,1,2,M,nccu,https://www.dcard.tw/f/nccu/p/235129955,dcard,post,有上課的大家知道怎麼寫嗎我有上課但實在不知道那些東西怎麼應用在企業轉型欸,"['有', '上課', '的', '大家', '知道', '怎麼', '寫', '嗎', '我', '有', '上課', '但', '實在', '不', '知道', '那些', '東西', '怎麼', '應用', '在', '企業', '轉型', '欸']","['上課', '知道', '寫', '上課', '實在', '知道', '東西', '應用', '企業', '轉型', '欸']",[],positive
144,235129938,"有人跟我一樣已經放寒假了嗎?
現在沒事做真的好無聊喔
只能去圖書館看那些還在拼期末的人
在心中默默地對他們說  可憐哪
有人有其他推薦的休閒娛樂嗎?",寒假開始,2021-01-07T08:36:37.998Z,2021-01-07T08:36:37.998Z,4,12,M,nccu,https://www.dcard.tw/f/nccu/p/235129938,dcard,post,有人跟我一樣已經放寒假了嗎現在沒事做真的好無聊喔只能去圖書館看那些還在拼期末的人在心中默默地對他們說可憐哪有人有其他推薦的休閒娛樂嗎,"['有', '人', '跟', '我', '一樣', '已經', '放', '寒假', '了', '嗎', '現在', '沒', '事', '做', '真的', '好', '無聊', '喔', '只', '能', '去', '圖書館', '看', '那些', '還', '在', '拼', '期末', '的', '人', '在', '心', '中', '默默地', '對', '他們', '說', '可憐', '哪', '有', '人', '有', '其他', '推薦', '的', '休閒', '娛樂', '嗎']","['人', '已經', '放', '寒假', '現在', '事', '做', '真的', '好', '無聊', '只', '圖書館', '拼', '期末', '人', '心', '中', '說', '可憐', '人', '推薦', '休閒', '娛樂']",[],negative
145,235129927,"如題，
https://i.imgur.com/F5bA5QG.jpg
從麥側進去就看到煙一陣一陣冒出來
求掛",政大火災,2021-01-07T08:35:06.097Z,2021-01-07T08:35:06.097Z,16,34,M,nccu,https://www.dcard.tw/f/nccu/p/235129927,dcard,post,如題從麥側進去就看到煙一陣一陣冒出來求掛,"['如', '題', '從', '麥側', '進去', '就', '看到', '煙', '一陣', '一陣', '冒出來', '求', '掛']","['題', '麥側', '看到', '煙', '一陣', '一陣', '冒出來', '求', '掛']",[],neutral
146,235129887,"今天真的上到快發芬
全部都聽不懂啦嗚嗚(;´༎ຶД༎ຶ`)",總經,2021-01-07T08:26:19.284Z,2021-01-07T08:26:19.284Z,4,8,F,nccu,https://www.dcard.tw/f/nccu/p/235129887,dcard,post,今天真的上到快發芬全部都聽不懂啦嗚嗚,"['今天', '真的', '上到', '快', '發芬', '全部', '都', '聽', '不', '懂', '啦', '嗚嗚']","['今天', '真的', '上到', '發芬', '全部', '聽', '懂', '嗚嗚']",[],neutral
147,235129732,這學期修了微積分、財政學、總經、個經、統計、中會！請問你們覺得一學期修這六科會很重嗎？感覺快要掛掉了,好硬的科目,2021-01-07T07:56:58.044Z,2021-01-07T07:56:58.044Z,39,32,M,nccu,https://www.dcard.tw/f/nccu/p/235129732,dcard,post,這學期修了微積分財政學總經個經統計中會請問你們覺得一學期修這六科會很重嗎感覺快要掛掉了,"['這', '學期', '修', '了', '微積分', '財政學', '總', '經', '個', '經', '統計', '中會', '請問', '你們', '覺得', '一', '學期', '修', '這', '六', '科', '會', '很', '重', '嗎', '感覺', '快要', '掛掉', '了']","['學期', '修', '微積分', '財政學', '總', '統計', '中會', '請問', '覺得', '學期', '修', '科', '重', '感覺', '掛掉']",[],neutral
