0,235156155,"今天看到考卷的時候心都涼了😭😭😭
怎麼考得這麼難啦


這樣期末是要叫我們怎麼拿90😡",小偉民概,2021-01-11T19:32:13.648Z,2021-01-11T19:32:44.928Z,1,0,M,nccu,https://www.dcard.tw/f/nccu/p/235156155,dcard,post,今天看到考卷的時候心都涼了怎麼考得這麼難啦這樣期末是要叫我們怎麼拿,"['今天', '看到', '考卷', '的', '時候心', '都', '涼', '了', '怎麼', '考', '得', '這麼', '難', '啦', '這樣', '期末', '是', '要', '叫', '我們', '怎麼', '拿']","['今天', '看到', '考卷', '時候心', '涼', '考', '難', '期末']",[],neutral
1,235156084,"認為「男生不知道政大而表現出態度不好的」
真的給我去重看影片
拜託
重看",罰你們去重看影片,2021-01-11T18:59:21.574Z,2021-01-11T18:59:21.574Z,0,0,M,nccu,https://www.dcard.tw/f/nccu/p/235156084,dcard,post,認為男生不知道政大而表現出態度不好的真的給我去重看影片拜託重看,"['認為', '男生', '不', '知道', '政大', '而', '表現出', '態度', '不', '好', '的', '真的', '給', '我', '去', '重看', '影片', '拜託', '重看']","['認為', '男生', '知道', '政大', '表現出', '態度', '好', '真的', '重看', '影片', '拜託', '重看']",[],negative
2,235155886,"怎麼最近的貼文一拉下來，很多都是法律系的在問期末考內容啊？
是因為很多課有去跟沒去都差不多所以才這樣，還是單純因為法律系人很多才造成問題多此一假象？
有沒有法律系的朋友可以解釋一下 
認真求問",法律系請進,2021-01-11T17:59:20.329Z,2021-01-11T17:59:20.329Z,4,1,M,nccu,https://www.dcard.tw/f/nccu/p/235155886,dcard,post,怎麼最近的貼文一拉下來很多都是法律系的在問期末考內容啊是因為很多課有去跟沒去都差不多所以才這樣還是單純因為法律系人很多才造成問題多此一假象有沒有法律系的朋友可以解釋一下認真求問,"['怎麼', '最近', '的', '貼文', '一', '拉下來', '很多', '都', '是', '法律系', '的', '在', '問', '期末考', '內容', '啊', '是', '因為', '很多', '課', '有', '去', '跟', '沒', '去', '都', '差不多', '所以', '才', '這樣', '還是', '單純', '因為', '法律系', '人', '很多', '才', '造成', '問題', '多', '此', '一', '假象', '有沒有', '法律系', '的', '朋友', '可以', '解釋', '一下', '認真', '求問']","['最近', '貼文', '拉下來', '法律系', '問', '期末考', '內容', '課', '法律系', '人', '造成', '問題', '假象', '有沒有', '法律系', '朋友', '解釋', '一下', '認真', '求問']",[],positive
3,235155839,"整個學期都沒有考試 只有期末一個
而且還聽說學長姐說改錯題超難…
好擔心明天的考試
雖然大家都說秦雯給分很佛
但好像也不太能放心…
想問問學長姐有沒有上過她行政法可能有考古題或題型可以參考的
網路上都找不太到…謝謝你們",吳秦雯行政法期末考請益,2021-01-11T17:47:57.585Z,2021-01-11T17:47:57.585Z,5,1,F,nccu,https://www.dcard.tw/f/nccu/p/235155839,dcard,post,整個學期都沒有考試只有期末一個而且還聽說學長姐說改錯題超難好擔心明天的考試雖然大家都說秦雯給分很佛但好像也不太能放心想問問學長姐有沒有上過她行政法可能有考古題或題型可以參考的網路上都找不太到謝謝你們,"['整個', '學期', '都', '沒有', '考試', '只有', '期末', '一', '個', '而且', '還', '聽說', '學長', '姐', '說', '改錯', '題超難', '好', '擔心', '明天', '的', '考試', '雖然', '大家', '都', '說', '秦雯', '給分', '很', '佛', '但', '好像', '也', '不', '太', '能', '放心', '想', '問問', '學長', '姐', '有沒有', '上過', '她', '行政法', '可能', '有', '考古題', '或', '題型', '可以', '參考', '的', '網路', '上', '都', '找', '不', '太', '到', '謝謝', '你們']","['整個', '學期', '考試', '期末', '聽說', '學長', '姐', '說', '改錯', '題超難', '好', '擔心', '明天', '考試', '說', '秦雯', '給分', '佛', '好像', '太', '放心', '想', '問問', '學長', '姐', '有沒有', '上過', '行政法', '考古題', '題型', '參考', '網路', '找', '太', '謝謝']",[],negative
4,235155784,"總經讀得好崩潰
不知道這次會不會考很難",洪福聲總經期末,2021-01-11T17:36:32.699Z,2021-01-11T17:36:32.699Z,5,7,M,nccu,https://www.dcard.tw/f/nccu/p/235155784,dcard,post,總經讀得好崩潰不知道這次會不會考很難,"['總', '經', '讀', '得', '好', '崩潰', '不', '知道', '這', '次', '會不會', '考', '很', '難']","['總', '讀', '好', '崩潰', '知道', '次', '會不會', '考', '難']",[],negative
5,235155670,"想請問一下修這門課的同學

最後一堂課好像有聽到老師說會挑其中三組的報告做考試範圍，想請問一下是哪三組的報告呢
我只有記到一組  而且也不是很確定…

感謝各位拯救我的期末QQ",陳純一國際公法期末考,2021-01-11T17:14:51.650Z,2021-01-11T17:14:51.650Z,2,2,M,nccu,https://www.dcard.tw/f/nccu/p/235155670,dcard,post,想請問一下修這門課的同學最後一堂課好像有聽到老師說會挑其中三組的報告做考試範圍想請問一下是哪三組的報告呢我只有記到一組而且也不是很確定感謝各位拯救我的期末,"['想', '請問', '一下', '修', '這', '門', '課', '的', '同學', '最後', '一', '堂', '課', '好像', '有', '聽到', '老師', '說', '會', '挑', '其中', '三組', '的', '報告', '做', '考試', '範圍', '想', '請問', '一下', '是', '哪', '三組', '的', '報告', '呢', '我', '只有', '記', '到', '一', '組', '而且', '也', '不', '是', '很', '確定', '感謝', '各位', '拯救', '我', '的', '期末']","['想', '請問', '一下', '修', '門', '課', '同學', '最後', '堂', '課', '好像', '聽到', '老師', '說', '挑', '三組', '報告', '做', '考試', '範圍', '想', '請問', '一下', '三組', '報告', '記', '組', '確定', '感謝', '拯救', '期末']",[],positive
6,235155489,抱歉，今天看到學妹跟另一個學長在一起讀書，偶爾摸摸臉、牽牽小手，悲從中來，心痛到連抽四包菸,心痛,2021-01-11T16:41:29.272Z,2021-01-11T16:41:29.272Z,7,7,M,nccu,https://www.dcard.tw/f/nccu/p/235155489,dcard,post,抱歉今天看到學妹跟另一個學長在一起讀書偶爾摸摸臉牽牽小手悲從中來心痛到連抽四包菸,"['抱歉', '今天', '看到', '學妹', '跟', '另', '一', '個', '學長', '在一起', '讀書', '偶爾', '摸摸', '臉', '牽牽', '小', '手', '悲從中來', '心痛', '到', '連', '抽', '四', '包', '菸']","['抱歉', '今天', '看到', '學妹', '學長', '在一起', '讀書', '摸摸', '臉', '牽牽', '小', '手', '悲從中來', '心痛', '抽', '包', '菸']",[],negative
7,235155402,"不知道是隔壁還是上面的人
莊九唱米津玄師歌的人
可以麻煩停止嗎🥺
而且一直重複一段
戴耳機還是可以聽到
原諒我沒有很好的耳機
謝謝你 期末all pass",莊九唱米津玄師歌的人,2021-01-11T16:23:36.533Z,2021-01-11T16:25:48.592Z,4,7,F,nccu,https://www.dcard.tw/f/nccu/p/235155402,dcard,post,不知道是隔壁還是上面的人莊九唱米津玄師歌的人可以麻煩停止嗎而且一直重複一段戴耳機還是可以聽到原諒我沒有很好的耳機謝謝你期末,"['不', '知道', '是', '隔壁', '還是', '上面', '的', '人莊九', '唱', '米津玄師歌', '的', '人', '可以', '麻煩', '停止', '嗎', '而且', '一直', '重複', '一段', '戴', '耳機', '還是', '可以', '聽到', '原諒', '我', '沒有', '很', '好', '的', '耳機', '謝謝', '你', '期末']","['知道', '隔壁', '上面', '人莊九', '唱', '米津玄師歌', '人', '麻煩', '停止', '一直', '重複', '一段', '戴', '耳機', '聽到', '原諒', '好', '耳機', '謝謝', '期末']",[],negative
8,235155084,"不好意思，來打擾大家。
期中後有一週（12/08）有事沒去上課，然後上禮拜聽到同學的心得分享，發現這堂課講了很多補充的筆記，像穹頂跟牆（？），因為課堂沒有認識的人，所以想問有沒有人可以分享一下這堂課的筆記，感激不盡 😭😭😭",政哲概筆記詢問,2021-01-11T15:32:41.850Z,2021-01-11T15:32:41.850Z,0,3,M,nccu,https://www.dcard.tw/f/nccu/p/235155084,dcard,post,不好意思來打擾大家期中後有一週有事沒去上課然後上禮拜聽到同學的心得分享發現這堂課講了很多補充的筆記像穹頂跟牆因為課堂沒有認識的人所以想問有沒有人可以分享一下這堂課的筆記感激不盡,"['不好意思', '來', '打擾', '大家', '期中', '後', '有', '一', '週', '有事', '沒', '去', '上課', '然後', '上', '禮拜', '聽到', '同學', '的', '心得', '分享', '發現', '這', '堂', '課', '講', '了', '很多', '補充', '的', '筆記', '像', '穹頂', '跟', '牆', '因為', '課堂', '沒有', '認識', '的', '人', '所以', '想', '問', '有沒有', '人', '可以', '分享', '一下', '這', '堂', '課', '的', '筆記', '感激', '不盡']","['不好意思', '打擾', '期中', '後', '週', '有事', '上課', '禮拜', '聽到', '同學', '心得', '分享', '發現', '堂', '課', '講', '補充', '筆記', '穹頂', '牆', '課堂', '認識', '人', '想', '問', '有沒有', '人', '分享', '一下', '堂', '課', '筆記', '感激', '不盡']",[],negative
9,235155064,"莊二都難民是不是只能洗冷水
幾天了啦垃圾學校",是要不要讓我們洗熱水啦,2021-01-11T15:29:58.959Z,2021-01-11T15:29:58.959Z,3,11,M,nccu,https://www.dcard.tw/f/nccu/p/235155064,dcard,post,莊二都難民是不是只能洗冷水幾天了啦垃圾學校,"['莊二', '都', '難民', '是', '不', '是', '只', '能', '洗', '冷水', '幾', '天', '了', '啦', '垃圾', '學校']","['莊二', '難民', '只', '洗', '冷水', '天', '垃圾', '學校']",[],negative
10,235154520,請問有修王國樑老師經濟學的同學，他上次上課有說有一題一定會考，請問是哪一題啊？拜託好心人說一下～之前沒聽到嗚嗚嗚,王國樑經濟學,2021-01-11T14:11:08.252Z,2021-01-11T14:11:08.252Z,7,3,F,nccu,https://www.dcard.tw/f/nccu/p/235154520,dcard,post,請問有修王國樑老師經濟學的同學他上次上課有說有一題一定會考請問是哪一題啊拜託好心人說一下之前沒聽到嗚嗚嗚,"['請問', '有', '修', '王國', '樑', '老師', '經濟學', '的', '同學', '他', '上', '次', '上課', '有', '說', '有', '一', '題', '一定', '會考', '請問', '是', '哪', '一', '題', '啊', '拜託', '好心人', '說', '一下', '之前', '沒', '聽到', '嗚', '嗚嗚']","['請問', '修', '王國', '樑', '老師', '經濟學', '同學', '次', '上課', '說', '題', '一定', '會考', '請問', '題', '拜託', '好心人', '說', '一下', '之前', '聽到', '嗚嗚']",[],negative
11,235154504,"本人的室友 平常大概都12-1點左右睡
我如果沒有考試的話 也差不多12點左右就去睡覺
但是有考試的話 有時候會2、3點才睡

然後我那個有公主病的室友呢
可能覺得我開著檯燈太亮 妨礙到她睡覺了
有時候會睡到一半(應該還沒睡著)
起來去廁所的時候 
用力跺腳+超大力甩廁所的門

然後她平常一直狂按滑鼠+乒乒乓乓製造一堆噪音
我都默默地把耳塞戴起來
我很少用筆電 偶爾用滑鼠的時候呢
剛用不到5分鐘就聽到她在那邊故意製造音量(發脾氣)
像是摔筆之類的

拜託 有公主病就待在家裡當小公主
不要出來禍害別人好嗎
讀個書還要看你的臉色


以上 本來期末壓力就很大了 
還有個公主病室友真的讓人超級不爽
大家就當作我需要地方發洩吧",有公主病就不要住宿舍,2021-01-11T14:09:04.338Z,2021-01-11T14:09:04.338Z,7,41,F,nccu,https://www.dcard.tw/f/nccu/p/235154504,dcard,post,本人的室友平常大概都點左右睡我如果沒有考試的話也差不多點左右就去睡覺但是有考試的話有時候會點才睡然後我那個有公主病的室友呢可能覺得我開著檯燈太亮妨礙到她睡覺了有時候會睡到一半應該還沒睡著起來去廁所的時候用力跺腳超大力甩廁所的門然後她平常一直狂按滑鼠乒乒乓乓製造一堆噪音我都默默地把耳塞戴起來我很少用筆電偶爾用滑鼠的時候呢剛用不到分鐘就聽到她在那邊故意製造音量發脾氣像是摔筆之類的拜託有公主病就待在家裡當小公主不要出來禍害別人好嗎讀個書還要看你的臉色以上本來期末壓力就很大了還有個公主病室友真的讓人超級不爽大家就當作我需要地方發洩吧,"['本人', '的', '室友', '平常', '大概', '都', '點', '左右', '睡', '我', '如果', '沒有', '考試', '的', '話', '也', '差不多', '點', '左右', '就', '去', '睡覺', '但是', '有', '考試', '的', '話', '有時候', '會', '點', '才', '睡', '然後', '我', '那', '個', '有', '公主病', '的', '室友', '呢', '可能', '覺得', '我', '開', '著', '檯燈', '太', '亮', '妨礙到', '她', '睡覺', '了', '有時候', '會', '睡到', '一半', '應該', '還', '沒', '睡著', '起來', '去', '廁所', '的', '時候', '用力', '跺腳', '超', '大力', '甩', '廁所', '的', '門', '然後', '她', '平常', '一直', '狂按', '滑鼠', '乒乒乓乓', '製造', '一', '堆', '噪音', '我', '都', '默默地', '把', '耳塞', '戴', '起來', '我', '很少', '用', '筆', '電', '偶爾', '用', '滑鼠', '的', '時候', '呢', '剛', '用不到', '分鐘', '就', '聽到', '她', '在', '那邊', '故意', '製造', '音量', '發脾氣', '像是', '摔', '筆', '之類', '的', '拜託', '有', '公主病', '就', '待在', '家', '裡', '當', '小', '公主', '不要', '出來', '禍害', '別人', '好', '嗎', '讀', '個', '書', '還要', '看', '你', '的', '臉色', '以上', '本來', '期末', '壓力', '就', '很', '大', '了', '還', '有', '個', '公主病', '室友', '真的', '讓', '人', '超級', '不', '爽', '大家', '就', '當作', '我', '需要', '地方', '發洩', '吧']","['室友', '平常', '點', '左右', '睡', '考試', '話', '點', '左右', '睡覺', '考試', '話', '有時候', '點', '睡', '公主病', '室友', '覺得', '開', '檯燈', '太', '亮', '妨礙到', '睡覺', '有時候', '睡到', '一半', '應該', '睡著', '廁所', '用力', '跺腳', '超', '大力', '甩', '廁所', '門', '平常', '一直', '狂按', '滑鼠', '乒乒乓乓', '製造', '堆', '噪音', '耳塞', '戴', '筆', '電', '滑鼠', '用不到', '分鐘', '聽到', '製造', '音量', '發脾氣', '像是', '摔', '筆', '拜託', '公主病', '待在', '家', '裡', '小', '公主', '禍害', '好', '讀', '書', '還要', '臉色', '以上', '本來', '期末', '壓力', '公主病', '室友', '真的', '人', '超級', '爽', '當作', '需要', '地方', '發洩']",[],negative
12,235154458,"一堆垃圾會在身障人士上圖書館的坡道那抽菸，之前我是大聲斥責或一直瞪他們啦～

下次打算要直接拍照檢舉跟著他或直接走去把他菸打掉
（第二種雖然很爽但代價是要聞到菸

祝我伸張正義成功~",躲在無障礙坡道抽菸,2021-01-11T14:01:05.190Z,2021-01-11T14:01:05.190Z,5,7,M,nccu,https://www.dcard.tw/f/nccu/p/235154458,dcard,post,一堆垃圾會在身障人士上圖書館的坡道那抽菸之前我是大聲斥責或一直瞪他們啦下次打算要直接拍照檢舉跟著他或直接走去把他菸打掉第二種雖然很爽但代價是要聞到菸祝我伸張正義成功,"['一', '堆', '垃圾', '會', '在', '身障', '人士', '上', '圖書館', '的', '坡道', '那', '抽菸', '之前', '我', '是', '大聲', '斥責', '或', '一直', '瞪', '他們', '啦', '下', '次', '打算', '要', '直接', '拍照', '檢舉', '跟', '著', '他', '或', '直接', '走去', '把', '他', '菸', '打掉', '第二', '種', '雖然', '很', '爽', '但', '代價', '是', '要', '聞到', '菸', '祝', '我', '伸張', '正義', '成功']","['堆', '垃圾', '身障', '人士', '圖書館', '坡道', '抽菸', '之前', '大聲', '斥責', '一直', '瞪', '下', '次', '打算', '直接', '拍照', '檢舉', '直接', '走去', '菸', '打掉', '第二', '種', '爽', '代價', '聞到', '菸', '祝', '伸張', '正義', '成功']",[],negative
13,235154275,"有沒有朋朋跟我一樣忙到忘記填期末教學評鑑的？
出個聲讓我知道我不孤單嗚嗚嗚嗚嗚ಥ_ಥ
沒有選課點點惹ಥ_ಥ",取暖勿鞭,2021-01-11T13:32:09.123Z,2021-01-11T13:32:53.028Z,14,15,F,nccu,https://www.dcard.tw/f/nccu/p/235154275,dcard,post,有沒有朋朋跟我一樣忙到忘記填期末教學評鑑的出個聲讓我知道我不孤單嗚嗚嗚嗚嗚沒有選課點點惹,"['有沒有', '朋朋', '跟', '我', '一樣', '忙到', '忘記', '填', '期末', '教學', '評鑑', '的', '出個聲', '讓', '我', '知道', '我', '不', '孤單', '嗚', '嗚嗚', '嗚嗚', '沒有', '選課', '點點', '惹']","['有沒有', '朋朋', '忙到', '忘記', '填', '期末', '教學', '評鑑', '出個聲', '知道', '孤單', '嗚嗚', '嗚嗚', '選課', '點點', '惹']",[],negative
14,235154199,"想請問除了作業的三分、參訪的兩分
秀雄是還會加五分嗎？

拜託了大家QQQ
我好想知道是我幻聽還是真的有這珍貴的五分",土地法 有沒有加分,2021-01-11T13:18:48.224Z,2021-01-11T13:18:48.224Z,7,4,F,nccu,https://www.dcard.tw/f/nccu/p/235154199,dcard,post,想請問除了作業的三分參訪的兩分秀雄是還會加五分嗎拜託了大家我好想知道是我幻聽還是真的有這珍貴的五分,"['想', '請問', '除了', '作業', '的', '三', '分', '參訪', '的', '兩', '分', '秀雄', '是', '還', '會', '加', '五', '分', '嗎', '拜託', '了', '大家', '我', '好', '想', '知道', '是', '我', '幻聽', '還是', '真的', '有', '這', '珍貴', '的', '五', '分']","['想', '請問', '作業', '分', '參訪', '兩', '分', '秀雄', '加', '分', '拜託', '好', '想', '知道', '幻聽', '真的', '珍貴', '分']",[],positive
15,235154177,"看到這篇的人都會歐趴喔🥳

https://www.dcard.tw/v2/vivid/videos/242b65e7-e15a-401f-9034-456ff8abbe91?r=1.3333333333333333
⬆️在安九即將被餵食的花花
https://www.dcard.tw/v2/vivid/videos/40b83378-710b-4b25-955e-9bcbc84d7836?r=1.3333333333333333
⬆️貪吃花好可愛！但怎麼好瘦😭
https://www.dcard.tw/v2/vivid/videos/2964fd07-61bd-4522-a67d-706b2d391393?r=1.3333333333333333
⬆️想進十舍交誼廳取暖的花！怎麼這麼可愛一早堵在門口等人幫他開！
https://www.dcard.tw/v2/vivid/videos/eeb8cef8-c54c-465d-a3fd-34921f850fc8?r=1.3333333333333333
⬆️直接爬上沙發的花！耍什麼大牌！
再三天就結束了！大家加油！",你已被期末好運花花拜訪,2021-01-11T13:15:26.299Z,2021-01-11T13:15:26.299Z,11,71,M,nccu,https://www.dcard.tw/f/nccu/p/235154177,dcard,post,看到這篇的人都會歐趴喔在安九即將被餵食的花花貪吃花好可愛但怎麼好瘦想進十舍交誼廳取暖的花怎麼這麼可愛一早堵在門口等人幫他開直接爬上沙發的花耍什麼大牌再三天就結束了大家加油,"['看到', '這', '篇', '的', '人', '都', '會', '歐', '趴', '喔', '在', '安九', '即將', '被', '餵食', '的', '花花', '貪吃花', '好', '可愛', '但', '怎麼', '好', '瘦', '想', '進十舍', '交誼廳', '取暖', '的', '花', '怎麼', '這麼', '可愛', '一早', '堵', '在', '門口', '等', '人', '幫', '他', '開', '直接', '爬上', '沙發', '的', '花', '耍', '什麼', '大牌', '再三', '天', '就', '結束', '了', '大家', '加油']","['看到', '篇', '人', '歐', '趴', '安九', '餵食', '花花', '貪吃花', '好', '可愛', '好', '瘦', '想', '進十舍', '交誼廳', '取暖', '花', '可愛', '一早', '堵', '門口', '人', '幫', '開', '直接', '爬上', '沙發', '花', '耍', '大牌', '再三', '天', '結束', '加油']",[],positive
16,235154068,"嗚嗚不知道有沒有明天也要考民訴的
內容好多好崩潰😢
祝大家歐趴💪💪",民訴讀不完好崩潰,2021-01-11T12:56:58.200Z,2021-01-11T12:56:58.200Z,14,9,F,nccu,https://www.dcard.tw/f/nccu/p/235154068,dcard,post,嗚嗚不知道有沒有明天也要考民訴的內容好多好崩潰祝大家歐趴,"['嗚嗚', '不', '知道', '有沒有', '明天', '也', '要', '考民訴', '的', '內容', '好多', '好', '崩潰', '祝', '大家', '歐', '趴']","['嗚嗚', '知道', '有沒有', '明天', '考民訴', '內容', '好多', '好', '崩潰', '祝', '歐', '趴']",[],negative
17,235153832,"前陣子跟政大小紅帽約會的男生被嘴到翻掉

哈哈台好佛哦還拍一集幫忙洗白

https://i.imgur.com/RPzmi1V.png

現在風向一個轉變欸，留言變成

“政大什麼咖？一定要知道嘛？”

其實也是蠻有道理ㄉ欸",並非所有人都需要知道政大,2021-01-11T12:16:01.560Z,2021-01-11T12:16:01.560Z,32,32,M,nccu,https://www.dcard.tw/f/nccu/p/235153832,dcard,post,前陣子跟政大小紅帽約會的男生被嘴到翻掉哈哈台好佛哦還拍一集幫忙洗白現在風向一個轉變欸留言變成政大什麼咖一定要知道嘛其實也是蠻有道理欸,"['前', '陣子', '跟', '政大', '小紅帽', '約會', '的', '男生', '被', '嘴', '到', '翻掉', '哈哈', '台好', '佛', '哦', '還', '拍', '一', '集', '幫忙', '洗白', '現在', '風向', '一', '個', '轉變', '欸', '留言', '變成', '政大', '什麼', '咖', '一定', '要', '知道', '嘛', '其實', '也', '是', '蠻', '有', '道理', '欸']","['前', '陣子', '政大', '小紅帽', '約會', '男生', '嘴', '翻掉', '台好', '佛', '拍', '集', '幫忙', '洗白', '現在', '風向', '轉變', '欸', '留言', '變成', '政大', '咖', '一定', '知道', '道理', '欸']",[],positive
