186,235123112,"感謝大家熱情的不私藏回覆！！
覺得不衛生的餐廳真的別去才好ㄋㄟ
歡迎打給也參考參考以下留言～
一起吃飽飽吃好好考好期末考😤
-
最近看到了關於朴媽媽的衛生問題那篇文章
身為小大一的我真的太震驚ㄌ！！！
（而且還很高興了吃過兩三次⋯）
想請問各位政大老鳥們有沒有推薦的餐廳
還有很不推的餐廳 如果有附上原因更好🥺

我先！
我很喜歡樂山～ 
主餐量（肉肉）很夠所以雖然單價不低 但cp值還蠻不錯ㄉ
白飯跟湯也都吃到飽😍
個人很推炸豬排+照燒醬哈哈哈

那就求大家的口袋名單🥴🥺",政大附近餐廳 推和不推,2021-01-06T07:14:51.261Z,2021-01-07T15:18:48.374Z,68,29,F,nccu,https://www.dcard.tw/f/nccu/p/235123112,dcard,post,感謝大家熱情的不私藏回覆覺得不衛生的餐廳真的別去才好歡迎打給也參考參考以下留言一起吃飽飽吃好好考好期末考最近看到了關於朴媽媽的衛生問題那篇文章身為小大一的我真的太震驚而且還很高興了吃過兩三次想請問各位政大老鳥們有沒有推薦的餐廳還有很不推的餐廳如果有附上原因更好我先我很喜歡樂山主餐量肉肉很夠所以雖然單價不低但值還蠻不錯白飯跟湯也都吃到飽個人很推炸豬排照燒醬哈哈哈那就求大家的口袋名單,"['感謝', '大家', '熱情', '的', '不', '私藏', '回覆', '覺得', '不', '衛生', '的', '餐廳', '真的', '別', '去', '才', '好', '歡迎', '打給', '也', '參考參考', '以下', '留言', '一起', '吃', '飽飽', '吃', '好好', '考好', '期末考', '最近', '看到', '了', '關於', '朴', '媽媽', '的', '衛生', '問題', '那', '篇', '文章', '身為', '小', '大一', '的', '我', '真的', '太', '震驚', '而且', '還', '很', '高興', '了', '吃', '過', '兩三', '次', '想', '請問', '各位', '政大', '老鳥', '們', '有沒有', '推薦', '的', '餐廳', '還', '有', '很', '不', '推', '的', '餐廳', '如果', '有', '附上', '原因', '更', '好', '我', '先', '我', '很', '喜歡', '樂山', '主餐', '量肉肉', '很', '夠', '所以', '雖然', '單價', '不', '低', '但', '值', '還', '蠻', '不錯', '白飯', '跟', '湯', '也', '都', '吃到', '飽個人', '很', '推', '炸豬排', '照', '燒醬哈', '哈哈', '那', '就', '求', '大家', '的', '口袋', '名單']","['感謝', '熱情', '私藏', '回覆', '覺得', '衛生', '餐廳', '真的', '好', '歡迎', '打給', '參考參考', '以下', '留言', '一起', '吃', '飽飽', '吃', '好好', '考好', '期末考', '最近', '看到', '朴', '媽媽', '衛生', '問題', '篇', '文章', '身為', '小', '大一', '真的', '太', '震驚', '高興', '吃', '兩三', '次', '想', '請問', '政大', '老鳥', '有沒有', '推薦', '餐廳', '推', '餐廳', '附上', '原因', '好', '先', '喜歡', '樂山', '主餐', '量肉肉', '夠', '單價', '低', '值', '不錯', '白飯', '湯', '吃到', '飽個人', '推', '炸豬排', '燒醬哈', '求', '口袋', '名單']",[],positive
187,235122585,中醫藥期末範圍是ppt 的6、7、8、11這四個單元嗎還是有加其他影片之類的呢，謝謝大家，祝大家期末順利照顧好身體，謝謝,中醫藥期末,2021-01-06T05:49:28.741Z,2021-01-06T05:49:28.741Z,8,4,F,nccu,https://www.dcard.tw/f/nccu/p/235122585,dcard,post,中醫藥期末範圍是的這四個單元嗎還是有加其他影片之類的呢謝謝大家祝大家期末順利照顧好身體謝謝,"['中', '醫藥', '期末', '範圍', '是', '的', '這', '四', '個', '單元', '嗎', '還是', '有加', '其他', '影片', '之類', '的', '呢', '謝謝', '大家', '祝', '大家', '期末', '順利', '照顧好', '身體', '謝謝']","['中', '醫藥', '期末', '範圍', '單元', '有加', '影片', '謝謝', '祝', '期末', '順利', '照顧好', '身體', '謝謝']",[],positive
188,235122474,"剛才跟朋友去吃午餐，朋友點招牌，吃到一半發現裡面有一隻蟲，本來還不太確定是不是，但看到有翅膀、頭，就覺得很噁心。

當下有跟服務生說，他問說要不要換一碗，但我們跟本不敢再吃，問說可不可以折價，他說老闆說不行，最後結帳的時候他才說那不然寫個單據下次來可以不限金額免費吃一碗。

我覺得態度是蠻好的，也有解釋說是因為他們的菜沒有農藥，他們也有盡量注意，要再給他們一次機會嗎？",甘泉魚麵有蟲,2021-01-06T05:31:29.923Z,2021-01-11T08:28:11.229Z,12,13,F,nccu,https://www.dcard.tw/f/nccu/p/235122474,dcard,post,剛才跟朋友去吃午餐朋友點招牌吃到一半發現裡面有一隻蟲本來還不太確定是不是但看到有翅膀頭就覺得很噁心當下有跟服務生說他問說要不要換一碗但我們跟本不敢再吃問說可不可以折價他說老闆說不行最後結帳的時候他才說那不然寫個單據下次來可以不限金額免費吃一碗我覺得態度是蠻好的也有解釋說是因為他們的菜沒有農藥他們也有盡量注意要再給他們一次機會嗎,"['剛才', '跟', '朋友', '去', '吃', '午餐', '朋友', '點', '招牌', '吃到', '一半', '發現', '裡面', '有', '一', '隻', '蟲', '本來', '還', '不', '太', '確定', '是', '不', '是', '但', '看到', '有', '翅膀', '頭', '就', '覺得', '很', '噁心', '當下', '有', '跟', '服務生', '說', '他', '問', '說', '要不要', '換', '一', '碗', '但', '我們', '跟', '本', '不', '敢', '再', '吃', '問', '說', '可不可以', '折價', '他', '說', '老闆', '說', '不行', '最後', '結帳', '的', '時候', '他', '才', '說', '那', '不然', '寫', '個', '單據', '下', '次', '來', '可以', '不', '限', '金額', '免費', '吃', '一', '碗', '我', '覺得', '態度', '是', '蠻', '好', '的', '也', '有', '解釋', '說', '是', '因為', '他們', '的', '菜', '沒有', '農藥', '他們', '也', '有', '盡量', '注意', '要', '再', '給', '他們', '一', '次', '機會', '嗎']","['朋友', '吃', '午餐', '朋友', '點', '招牌', '吃到', '一半', '發現', '裡面', '隻', '蟲', '本來', '太', '確定', '看到', '翅膀', '頭', '覺得', '噁心', '服務生', '說', '問', '說', '要不要', '換', '碗', '再', '吃', '問', '說', '可不可以', '折價', '說', '老闆', '說', '不行', '最後', '結帳', '說', '寫', '單據', '下', '次', '限', '金額', '免費', '吃', '碗', '覺得', '態度', '好', '解釋', '說', '菜', '農藥', '盡量', '注意', '再', '次', '機會']",[],positive
189,235122074,"今天早上的我因為腸胃炎而痛苦的在床上和廁所來回奔波
沒辦法去上課
所以想請問有修這堂課的人
這次期末的範圍跟考題類型是什麼QQ
先謝謝回答的各位ㄌ...你們真好心...祝期末分數高高...",李聖傑 刑法一 期末考,2021-01-06T04:23:46.537Z,2021-01-06T04:24:45.115Z,13,5,F,nccu,https://www.dcard.tw/f/nccu/p/235122074,dcard,post,今天早上的我因為腸胃炎而痛苦的在床上和廁所來回奔波沒辦法去上課所以想請問有修這堂課的人這次期末的範圍跟考題類型是什麼先謝謝回答的各位你們真好心祝期末分數高高,"['今天', '早上', '的', '我', '因為', '腸胃炎', '而', '痛苦', '的', '在', '床', '上', '和', '廁所', '來回', '奔波', '沒辦法', '去', '上課', '所以', '想', '請問', '有', '修', '這', '堂', '課', '的', '人', '這', '次', '期末', '的', '範圍', '跟', '考題', '類型', '是', '什麼', '先', '謝謝', '回答', '的', '各位', '你們', '真', '好心', '祝', '期末', '分數', '高高']","['今天', '早上', '腸胃炎', '痛苦', '床', '廁所', '來回', '奔波', '沒辦法', '上課', '想', '請問', '修', '堂', '課', '人', '次', '期末', '範圍', '考題', '類型', '先', '謝謝', '回答', '真', '好心', '祝', '期末', '分數', '高高']",[],negative
190,235122006,"期末考旁邊的女生真的好臭 希望妳下次來考試可以洗個澡臭死了 臭到我提早交卷！

不是啊，女生怎麼可以這麼臭，同學拜託你不要這麼臭！拜託！",同學 妳可以不要那麼臭嗎,2021-01-06T04:12:16.405Z,2021-01-06T04:12:16.405Z,29,60,M,nccu,https://www.dcard.tw/f/nccu/p/235122006,dcard,post,期末考旁邊的女生真的好臭希望妳下次來考試可以洗個澡臭死了臭到我提早交卷不是啊女生怎麼可以這麼臭同學拜託你不要這麼臭拜託,"['期末考', '旁邊', '的', '女生', '真的', '好', '臭', '希望', '妳', '下', '次', '來', '考試', '可以', '洗', '個', '澡', '臭死', '了', '臭', '到', '我', '提早', '交卷', '不', '是', '啊', '女生', '怎麼', '可以', '這麼', '臭', '同學', '拜託', '你', '不要', '這麼', '臭', '拜託']","['期末考', '旁邊', '女生', '真的', '好', '希望', '妳', '下', '次', '考試', '洗', '澡', '臭死', '提早', '交卷', '女生', '同學', '拜託', '拜託']",[],negative
191,235121433,大一菜雞想問一下，秀明老師的民法期末考跟他發的考古題有關嗎，讀了一堆還是沒方向QQ,吳秀明民法（一）期末考,2021-01-06T02:15:45.221Z,2021-01-06T02:15:45.221Z,12,10,M,nccu,https://www.dcard.tw/f/nccu/p/235121433,dcard,post,大一菜雞想問一下秀明老師的民法期末考跟他發的考古題有關嗎讀了一堆還是沒方向,"['大一', '菜雞', '想', '問', '一下', '秀明', '老師', '的', '民法', '期末考', '跟', '他', '發', '的', '考古題', '有關', '嗎', '讀', '了', '一', '堆', '還是', '沒', '方向']","['大一', '菜雞', '想', '問', '一下', '秀明', '老師', '民法', '期末考', '發', '考古題', '讀', '堆', '方向']",[],neutral
192,235121424,"大家早安

從上學期開始
為了確認追蹤各課堂的出席人數
學校推出了一個防疫QR Code
其實就是實名制啦

學校雖然說
老師不能以防疫點名作為出席率的評分
但本魯還是有很多堂課搞這個

想知道各堂課上
目前還有積極在掃防疫點名嗎
或是繼續以防疫點名作為出席率的評分？",現在各堂課防疫點名的情況？,2021-01-06T02:12:52.359Z,2021-01-06T02:12:52.359Z,15,14,M,nccu,https://www.dcard.tw/f/nccu/p/235121424,dcard,post,大家早安從上學期開始為了確認追蹤各課堂的出席人數學校推出了一個防疫其實就是實名制啦學校雖然說老師不能以防疫點名作為出席率的評分但本魯還是有很多堂課搞這個想知道各堂課上目前還有積極在掃防疫點名嗎或是繼續以防疫點名作為出席率的評分,"['大家', '早安', '從', '上', '學期', '開始', '為了', '確認', '追蹤', '各', '課堂', '的', '出席', '人數', '學校', '推出', '了', '一', '個', '防疫', '其實', '就是', '實名制', '啦', '學校', '雖然', '說', '老師', '不能', '以', '防疫', '點名', '作為', '出席率', '的', '評分', '但', '本', '魯', '還是', '有', '很多', '堂', '課', '搞', '這', '個', '想', '知道', '各', '堂', '課', '上', '目前', '還', '有', '積極', '在', '掃', '防疫', '點名', '嗎', '或是', '繼續', '以', '防疫', '點名', '作為', '出席率', '的', '評分']","['早安', '學期', '確認', '追蹤', '課堂', '出席', '人數', '學校', '推出', '防疫', '實名制', '學校', '說', '老師', '防疫', '點名', '出席率', '評分', '魯', '堂', '課', '搞', '想', '知道', '堂', '課', '目前', '積極', '掃', '防疫', '點名', '繼續', '防疫', '點名', '出席率', '評分']",[],positive
193,235121196,"平時喜歡寫一些東西，散文小說之類的不同風格都有接觸，想問大家如果想要累積人氣甚至賺錢，推薦在什麼網路平台上公開呢？
畢竟身在台灣，常常被很多對岸的規定限制侷限（像帳號無法註冊、實名制之類的，當然還有一些某部位不能寫的奇怪的規定）想要藉由寫作獲得收益就更難了。
不知道有沒有同道能推薦下台灣的（對岸提供台灣手機號註冊也可）小說連載平台，而且是可以拿到真實收入，不是虛擬幣那種，拜託啦~",有寫作經驗的平常喜歡將文章發表在哪個平台呀？,2021-01-06T00:56:19.209Z,2021-01-06T00:56:19.209Z,16,20,F,nccu,https://www.dcard.tw/f/nccu/p/235121196,dcard,post,平時喜歡寫一些東西散文小說之類的不同風格都有接觸想問大家如果想要累積人氣甚至賺錢推薦在什麼網路平台上公開呢畢竟身在台灣常常被很多對岸的規定限制侷限像帳號無法註冊實名制之類的當然還有一些某部位不能寫的奇怪的規定想要藉由寫作獲得收益就更難了不知道有沒有同道能推薦下台灣的對岸提供台灣手機號註冊也可小說連載平台而且是可以拿到真實收入不是虛擬幣那種拜託啦,"['平時', '喜歡', '寫', '一些', '東西', '散文', '小說', '之類', '的', '不同', '風格', '都', '有', '接觸', '想', '問', '大家', '如果', '想要', '累積', '人氣', '甚至', '賺錢', '推薦', '在', '什麼', '網路', '平台', '上', '公開', '呢', '畢竟', '身在', '台灣', '常常', '被', '很多', '對岸', '的', '規定', '限制', '侷限', '像', '帳號', '無法', '註冊', '實名制', '之類', '的', '當然', '還', '有', '一些', '某', '部位', '不能', '寫', '的', '奇怪', '的', '規定', '想要', '藉由', '寫作', '獲得', '收益', '就', '更', '難', '了', '不', '知道', '有沒有', '同道', '能', '推薦', '下', '台灣', '的', '對岸', '提供', '台灣', '手機號', '註冊', '也', '可', '小說', '連載', '平台', '而且', '是', '可以', '拿到', '真實', '收入', '不', '是', '虛擬', '幣', '那', '種', '拜託', '啦']","['平時', '喜歡', '寫', '一些', '東西', '散文', '小說', '風格', '接觸', '想', '問', '想要', '累積', '人氣', '賺錢', '推薦', '網路', '平台', '公開', '身在', '台灣', '對岸', '規定', '限制', '侷限', '帳號', '無法', '註冊', '實名制', '一些', '部位', '寫', '奇怪', '規定', '想要', '藉由', '寫作', '獲得', '收益', '難', '知道', '有沒有', '同道', '推薦', '下', '台灣', '對岸', '提供', '台灣', '手機號', '註冊', '小說', '連載', '平台', '拿到', '真實', '收入', '虛擬', '幣', '種', '拜託']",[],positive
194,235120642,"如題⋯⋯上禮拜睡過頭沒聽到，沒有朋友的外系仔想問有沒有人知道老師說期末什麼時候考呢😭😭
祝大家期末歐趴",宜杰靜影期末,2021-01-05T18:21:29.253Z,2021-01-05T18:21:29.253Z,4,9,F,nccu,https://www.dcard.tw/f/nccu/p/235120642,dcard,post,如題上禮拜睡過頭沒聽到沒有朋友的外系仔想問有沒有人知道老師說期末什麼時候考呢祝大家期末歐趴,"['如', '題', '上', '禮拜', '睡', '過頭', '沒', '聽到', '沒有', '朋友', '的', '外系仔', '想', '問', '有沒有', '人', '知道', '老師', '說', '期末', '什麼', '時候', '考', '呢', '祝', '大家', '期末', '歐', '趴']","['題', '禮拜', '睡', '過頭', '聽到', '朋友', '外系仔', '想', '問', '有沒有', '人', '知道', '老師', '說', '期末', '考', '祝', '期末', '歐', '趴']",[],negative
195,235120453,期末怎麼進行呀？看老師紙本好像是要考試對吧？🙏🙏,江玉林法緒！,2021-01-05T17:41:48.502Z,2021-01-05T17:41:48.502Z,4,6,M,nccu,https://www.dcard.tw/f/nccu/p/235120453,dcard,post,期末怎麼進行呀看老師紙本好像是要考試對吧,"['期末', '怎麼', '進行', '呀', '看', '老師', '紙', '本', '好像', '是', '要', '考試', '對', '吧']","['期末', '進行', '老師', '紙', '好像', '考試']",[],positive
196,235120389,"政大雨都大家都知道
撐傘本身也不是什麼問題
可是那個撐傘的高度啊可就有點學問了

撐不到180的高度直接戳到我們的眼睛
每次下雨遇到人多
都面臨戳戳樂 
躲得很辛苦餒

搞不好哪次貼心的同學有注意到周遭的話
還能獲得人家的微笑與感謝
說不定還有進一步發展機會

拜託行行好⋯⋯",要有180男友要先做到的事,2021-01-05T17:27:59.821Z,2021-01-05T17:27:59.821Z,6,21,M,nccu,https://www.dcard.tw/f/nccu/p/235120389,dcard,post,政大雨都大家都知道撐傘本身也不是什麼問題可是那個撐傘的高度啊可就有點學問了撐不到的高度直接戳到我們的眼睛每次下雨遇到人多都面臨戳戳樂躲得很辛苦餒搞不好哪次貼心的同學有注意到周遭的話還能獲得人家的微笑與感謝說不定還有進一步發展機會拜託行行好,"['政', '大雨', '都', '大家', '都', '知道', '撐傘', '本身', '也', '不', '是', '什麼', '問題', '可是', '那', '個', '撐傘', '的', '高度', '啊', '可就', '有點', '學問', '了', '撐', '不', '到', '的', '高度', '直接', '戳到', '我們', '的', '眼睛', '每', '次', '下雨', '遇到', '人', '多', '都', '面臨', '戳戳', '樂', '躲得', '很', '辛苦', '餒', '搞不好', '哪', '次', '貼心', '的', '同學', '有', '注意到', '周遭', '的', '話', '還', '能', '獲得', '人家', '的', '微笑', '與', '感謝', '說不定', '還', '有', '進一步', '發展', '機會', '拜託', '行行好']","['政', '大雨', '知道', '撐傘', '問題', '撐傘', '高度', '可就', '有點', '學問', '撐', '高度', '直接', '戳到', '眼睛', '次', '下雨', '遇到', '人', '面臨', '戳戳', '樂', '躲得', '辛苦', '餒', '搞不好', '次', '貼心', '同學', '注意到', '周遭', '話', '獲得', '微笑', '感謝', '說不定', '進一步', '發展', '機會', '拜託', '行行好']",[],positive
197,235120106,"政大從how哥就讀時期，偷傘賊就已經橫行了
經過了十多年的歲月，偷傘文還常出現在交流板上
為了遏止偷傘，我提議可以在新生訓練、防災或是聽校長廢話（？，挪用個五分鐘來讓全校宣示不偷傘誓言，並在所有偷傘賊盛行之處張貼標語「防範偷傘，人人有責」 ，並成立偷傘處理小組來協助偷傘的後續處理調查程序sop，以降低處理偷傘賊的成本，以示我們對偷傘賊絕不姑息的決心，並舉辦政大雨傘節，以行動或是裝置藝術來提醒大家雨傘重要性，讓偷傘賊不敢橫行，最後我們將對抓到的偷傘賊公開在交流板上，讓其體會社會性死亡！！
政大是個未來會出很多官員以及社會中堅的學校，這個創舉將在法治及政策施行上是學生政治的里程碑，讓台灣更走向法治國家，偷傘賊十年計畫，十年有成！！！！",《討論》關於遏止偷傘,2021-01-05T16:46:44.256Z,2021-01-05T16:46:44.256Z,8,41,M,nccu,https://www.dcard.tw/f/nccu/p/235120106,dcard,post,政大從哥就讀時期偷傘賊就已經橫行了經過了十多年的歲月偷傘文還常出現在交流板上為了遏止偷傘我提議可以在新生訓練防災或是聽校長廢話挪用個五分鐘來讓全校宣示不偷傘誓言並在所有偷傘賊盛行之處張貼標語防範偷傘人人有責並成立偷傘處理小組來協助偷傘的後續處理調查程序以降低處理偷傘賊的成本以示我們對偷傘賊絕不姑息的決心並舉辦政大雨傘節以行動或是裝置藝術來提醒大家雨傘重要性讓偷傘賊不敢橫行最後我們將對抓到的偷傘賊公開在交流板上讓其體會社會性死亡政大是個未來會出很多官員以及社會中堅的學校這個創舉將在法治及政策施行上是學生政治的里程碑讓台灣更走向法治國家偷傘賊十年計畫十年有成,"['政大', '從', '哥', '就讀', '時期', '偷傘', '賊', '就', '已經', '橫行', '了', '經過', '了', '十多', '年', '的', '歲月', '偷傘文', '還', '常', '出現', '在', '交流板', '上', '為了', '遏止', '偷傘', '我', '提議', '可以', '在', '新生', '訓練', '防災', '或是', '聽', '校長', '廢話', '挪用', '個', '五', '分鐘', '來', '讓', '全', '校', '宣示', '不', '偷傘', '誓言', '並', '在', '所有', '偷傘', '賊', '盛行', '之', '處', '張貼', '標語', '防範', '偷傘', '人人', '有責', '並', '成立', '偷傘', '處理', '小組', '來', '協助', '偷傘', '的', '後續', '處理', '調查', '程序', '以', '降低', '處理', '偷傘', '賊', '的', '成本', '以', '示', '我們', '對', '偷傘', '賊', '絕不', '姑息', '的', '決心', '並', '舉辦', '政大', '雨傘節', '以', '行動', '或是', '裝置', '藝術', '來', '提醒', '大家', '雨傘', '重要性', '讓', '偷傘', '賊', '不', '敢', '橫行', '最後', '我們', '將', '對', '抓到', '的', '偷傘', '賊', '公開', '在', '交流板', '上', '讓', '其', '體會', '社會性', '死亡', '政大', '是', '個', '未來', '會', '出', '很多', '官員', '以及', '社會', '中堅', '的', '學校', '這', '個', '創舉', '將', '在', '法治', '及', '政策', '施行', '上', '是', '學生', '政治', '的', '里程碑', '讓', '台灣', '更', '走向', '法治', '國家', '偷傘', '賊', '十年', '計畫', '十年', '有成']","['政大', '哥', '就讀', '時期', '偷傘', '賊', '已經', '橫行', '十多', '年', '歲月', '偷傘文', '出現', '交流板', '遏止', '偷傘', '提議', '新生', '訓練', '防災', '聽', '校長', '廢話', '挪用', '分鐘', '全', '校', '宣示', '偷傘', '誓言', '所有', '偷傘', '賊', '盛行', '處', '張貼', '標語', '防範', '偷傘', '有責', '成立', '偷傘', '處理', '小組', '協助', '偷傘', '後續', '處理', '調查', '程序', '降低', '處理', '偷傘', '賊', '成本', '示', '偷傘', '賊', '姑息', '決心', '舉辦', '政大', '雨傘節', '行動', '裝置', '藝術', '提醒', '雨傘', '重要性', '偷傘', '賊', '橫行', '最後', '抓到', '偷傘', '賊', '公開', '交流板', '體會', '社會性', '死亡', '政大', '未來', '官員', '社會', '中堅', '學校', '創舉', '法治', '政策', '施行', '學生', '政治', '里程碑', '台灣', '走向', '法治', '國家', '偷傘', '賊', '十年', '計畫', '十年', '有成']","['偷傘', '賊', '政大']",negative
198,235120059,以下節錄你們的對話內容：欸我今天很早起床欸~，希望這可以幫助你們認出自己，對話大概在1/6 00：30的時候發生，已經不是第一次聽到你們聊天的聲音，我相信你們也不想要打擾的其他人，只是不知道在那裡講話會被其他人聽到，喔對了我是二樓的小伙伴，不知道為什麼反正你們的聲音好像很容易傳到我們房間，可能跟你們講話的地方位置有關。,自強7舍3樓的同學，你們的對話太大聲了喔,2021-01-05T16:40:02.462Z,2021-01-05T16:40:02.462Z,0,14,F,nccu,https://www.dcard.tw/f/nccu/p/235120059,dcard,post,以下節錄你們的對話內容欸我今天很早起床欸希望這可以幫助你們認出自己對話大概在的時候發生已經不是第一次聽到你們聊天的聲音我相信你們也不想要打擾的其他人只是不知道在那裡講話會被其他人聽到喔對了我是二樓的小伙伴不知道為什麼反正你們的聲音好像很容易傳到我們房間可能跟你們講話的地方位置有關,"['以下', '節錄', '你們', '的', '對話', '內容', '欸', '我', '今天', '很', '早', '起床', '欸', '希望', '這', '可以', '幫助', '你們', '認出', '自己', '對話', '大概', '在', '的', '時候', '發生', '已經', '不', '是', '第一', '次', '聽到', '你們', '聊天', '的', '聲音', '我', '相信', '你們', '也', '不', '想要', '打擾', '的', '其他', '人', '只是', '不', '知道', '在', '那裡', '講話', '會', '被', '其他', '人', '聽到', '喔', '對了', '我', '是', '二樓', '的', '小', '伙伴', '不', '知道', '為什麼', '反正', '你們', '的', '聲音', '好像', '很', '容易', '傳到', '我們', '房間', '可能', '跟', '你們', '講話', '的', '地方', '位置', '有關']","['以下', '節錄', '對話', '內容', '欸', '今天', '早', '起床', '欸', '希望', '幫助', '認出', '對話', '發生', '已經', '第一', '次', '聽到', '聊天', '聲音', '相信', '想要', '打擾', '人', '知道', '那裡', '講話', '人', '聽到', '對了', '二樓', '小', '伙伴', '知道', '反正', '聲音', '好像', '容易', '傳到', '房間', '講話', '地方', '位置']",[],positive
199,235119590,"最近莊二大概10點後都沒熱水了
只有那種比冷水還不冷一點的水
真是氣死人欸
之前每個星期停水維修
是修心酸的嗎？",莊內熱水,2021-01-05T15:42:08.798Z,2021-01-05T15:42:08.798Z,3,10,M,nccu,https://www.dcard.tw/f/nccu/p/235119590,dcard,post,最近莊二大概點後都沒熱水了只有那種比冷水還不冷一點的水真是氣死人欸之前每個星期停水維修是修心酸的嗎,"['最近', '莊', '二', '大概', '點', '後', '都', '沒', '熱水', '了', '只有', '那', '種', '比', '冷水', '還', '不', '冷', '一點', '的', '水', '真是', '氣死人', '欸', '之前', '每', '個', '星期', '停', '水', '維修', '是', '修', '心酸', '的', '嗎']","['最近', '莊', '點', '後', '熱水', '種', '冷水', '冷', '一點', '水', '真是', '氣死人', '欸', '之前', '星期', '停', '水', '維修', '修', '心酸']",[],negative
