165,235119944,住11樓接近尾端窗戶那邊的他媽的每次講電話我都聽得到，還有樓上12樓的洗個澡是在拆房子？一直發出咚咚咚的聲音到底是三小，辱罵跟好言相勸都沒有用，我已經忍你們一個學期了！！！,太子學舍11樓和12樓的住戶,2021-01-05T16:25:16.934Z,2021-01-05T16:25:16.934Z,2,5,M,ncku,https://www.dcard.tw/f/ncku/p/235119944,dcard,post,住樓接近尾端窗戶那邊的他媽的每次講電話我都聽得到還有樓上樓的洗個澡是在拆房子一直發出咚咚咚的聲音到底是三小辱罵跟好言相勸都沒有用我已經忍你們一個學期了,"['住樓', '接近', '尾端', '窗戶', '那邊', '的', '他媽的', '每', '次', '講', '電話', '我', '都', '聽得到', '還', '有', '樓上', '樓', '的', '洗', '個', '澡', '是', '在', '拆', '房子', '一直', '發出', '咚', '咚咚', '的', '聲音', '到底', '是', '三', '小', '辱罵', '跟', '好言相勸', '都', '沒有用', '我', '已經', '忍', '你們', '一', '個', '學期', '了']","['住樓', '接近', '尾端', '窗戶', '他媽的', '次', '講', '電話', '聽得到', '樓上', '樓', '洗', '澡', '拆', '房子', '一直', '發出', '咚咚', '聲音', '小', '辱罵', '好言相勸', '沒有用', '已經', '忍', '學期']",[],negative
166,235119895,"進來校版一看整排滑過去都是油圖
而且有一半是vtuber
好像是叫hololive？
拜託一下，這裡不是讓你們這樣搞的

















照顧一下我們犬山哥好嗎",校版限動一堆油圖是怎樣,2021-01-05T16:19:01.741Z,2021-01-05T16:19:01.741Z,6,4,M,ncku,https://www.dcard.tw/f/ncku/p/235119895,dcard,post,進來校版一看整排滑過去都是油圖而且有一半是好像是叫拜託一下這裡不是讓你們這樣搞的照顧一下我們犬山哥好嗎,"['進來', '校版', '一', '看', '整', '排', '滑過', '去', '都', '是', '油圖', '而且', '有', '一半', '是', '好像', '是', '叫', '拜託', '一下', '這裡', '不', '是', '讓', '你們', '這樣', '搞', '的', '照顧', '一下', '我們', '犬山哥', '好', '嗎']","['校版', '整', '排', '滑過', '油圖', '一半', '好像', '拜託', '一下', '這裡', '搞', '照顧', '一下', '犬山哥', '好']",[],negative
167,235119720,"在趕明天的考試，四學分的課考半學期
偏向背科  唸了又忘 忘了沒時間唸了
花了一個下午加晚上邊看邊寫題目
可是同學卻可以在半小時內寫完
剛剛終於意識到了
我只不過是努力一點的普通人

明明也知道別和他人比的道理
那些讀書唸進去比較重要云云
也想過是不是找不到自己唸書的方法
都不是 我知道現在這樣大概是我能做到最好的方式了

好像自從你一直在一個高度 沒有掉下來過
越晚意識的越痛
有人是升高中 有人是大一  都大三我才突然感受到自己其實沒有想像中的那麼優秀
每次都是拼死拼活唸
真的好累  但又不敢掉下來
我已經不知道是哪來的鬼期許了
明明放開會比較快樂不是嗎
但腦裡又有另一種聲音說 
實習要成績 交換要成績  當你拿不出什麼比成績更好看的東西 競賽啊 閱歷啊 就只剩成績了
怎麼活到那麼悲哀",努力一點的普通人,2021-01-05T15:58:04.583Z,2021-01-05T16:07:18.906Z,20,100,F,ncku,https://www.dcard.tw/f/ncku/p/235119720,dcard,post,在趕明天的考試四學分的課考半學期偏向背科唸了又忘忘了沒時間唸了花了一個下午加晚上邊看邊寫題目可是同學卻可以在半小時內寫完剛剛終於意識到了我只不過是努力一點的普通人明明也知道別和他人比的道理那些讀書唸進去比較重要云云也想過是不是找不到自己唸書的方法都不是我知道現在這樣大概是我能做到最好的方式了好像自從你一直在一個高度沒有掉下來過越晚意識的越痛有人是升高中有人是大一都大三我才突然感受到自己其實沒有想像中的那麼優秀每次都是拼死拼活唸真的好累但又不敢掉下來我已經不知道是哪來的鬼期許了明明放開會比較快樂不是嗎但腦裡又有另一種聲音說實習要成績交換要成績當你拿不出什麼比成績更好看的東西競賽啊閱歷啊就只剩成績了怎麼活到那麼悲哀,"['在', '趕', '明天', '的', '考試', '四', '學分', '的', '課考', '半', '學期', '偏向', '背科唸', '了', '又', '忘', '忘', '了', '沒', '時間', '唸', '了', '花', '了', '一', '個', '下午', '加晚', '上邊', '看', '邊', '寫', '題目', '可是', '同學', '卻', '可以', '在', '半', '小時', '內', '寫完', '剛剛', '終於', '意識到', '了', '我', '只不過', '是', '努力', '一點', '的', '普通人', '明明', '也', '知道', '別', '和', '他人', '比', '的', '道理', '那些', '讀書', '唸', '進去', '比較', '重要', '云云', '也', '想', '過', '是', '不', '是', '找', '不', '到', '自己', '唸書', '的', '方法', '都', '不', '是', '我', '知道', '現在', '這樣', '大概', '是', '我', '能', '做到', '最好', '的', '方式', '了', '好像', '自從', '你', '一直', '在', '一', '個', '高度', '沒有', '掉下來', '過', '越', '晚', '意識', '的', '越', '痛', '有', '人', '是', '升高', '中', '有', '人', '是', '大一', '都', '大三', '我', '才', '突然', '感受到', '自己', '其實', '沒有', '想像', '中', '的', '那麼', '優秀', '每', '次', '都', '是', '拼死', '拼活唸', '真的', '好', '累', '但', '又', '不', '敢', '掉下來', '我', '已經', '不', '知道', '是', '哪來', '的', '鬼', '期許', '了', '明明', '放開', '會', '比較', '快樂', '不', '是', '嗎', '但', '腦', '裡', '又', '有', '另', '一', '種', '聲音', '說', '實習', '要', '成績', '交換', '要', '成績', '當', '你', '拿', '不', '出', '什麼', '比', '成績', '更', '好看', '的', '東西', '競賽', '啊', '閱歷', '啊', '就', '只', '剩', '成績', '了', '怎麼', '活到', '那麼', '悲哀']","['明天', '考試', '學分', '課考', '學期', '偏向', '背科唸', '忘', '忘', '時間', '唸', '花', '下午', '加晚', '上邊', '寫', '題目', '同學', '卻', '小時', '寫完', '剛剛', '終於', '意識到', '只不過', '努力', '一點', '普通人', '明明', '知道', '道理', '讀書', '唸', '比較', '重要', '云云', '想', '找', '唸書', '方法', '知道', '現在', '做到', '最好', '方式', '好像', '一直', '高度', '掉下來', '越', '晚', '意識', '越', '痛', '人', '升高', '中', '人', '大一', '大三', '突然', '感受到', '想像', '中', '優秀', '次', '拼死', '拼活唸', '真的', '好', '累', '掉下來', '已經', '知道', '哪來', '鬼', '期許', '明明', '放開', '比較', '快樂', '腦', '裡', '種', '聲音', '說', '實習', '成績', '交換', '成績', '成績', '好看', '東西', '競賽', '閱歷', '只', '剩', '成績', '活到', '悲哀']",[],positive
168,235119496,"借個版來問一下作業⋯⋯
有沒有人是修星期五早上的西洋經濟史（蔡仰虔教授的） 
我想問一下期末指定影片是哪一部 ～？
然後期末作業上寫說 指定日期繳交是什麼時候？
拜託拜託救救期末🙏",西洋經濟史,2021-01-05T15:32:38.836Z,2021-01-05T15:32:38.836Z,4,0,F,ncku,https://www.dcard.tw/f/ncku/p/235119496,dcard,post,借個版來問一下作業有沒有人是修星期五早上的西洋經濟史蔡仰虔教授的我想問一下期末指定影片是哪一部然後期末作業上寫說指定日期繳交是什麼時候拜託拜託救救期末,"['借個版', '來', '問', '一下', '作業', '有沒有', '人', '是', '修', '星期五', '早上', '的', '西洋', '經濟史', '蔡仰虔', '教授', '的', '我', '想', '問', '一下', '期末', '指定', '影片', '是', '哪', '一', '部', '然後', '期末', '作業', '上', '寫', '說', '指定', '日期', '繳交', '是', '什麼', '時候', '拜託拜託', '救救', '期末']","['借個版', '問', '一下', '作業', '有沒有', '人', '修', '星期五', '早上', '西洋', '經濟史', '蔡仰虔', '教授', '想', '問', '一下', '期末', '指定', '影片', '部', '期末', '作業', '寫', '說', '指定', '日期', '繳交', '拜託拜託', '救救', '期末']",[],neutral
169,235119419,"已經心情低落一兩個月了，做什麼事都沒有力氣，不懂為什麼我每隔幾個月就要這樣子陷入低潮。
明明還有五科期末要考，但是就是無法專注在上面。
食慾都好好的，也不會想要去死一死，但是就是不知道現在活著的意義是什麼。
有時候好希望自己其實有病，這樣我就可以把這些狗屎爛蛋的低潮情緒都怪在那些心裡疾病上，而不是承認我的人生就是活得很失敗。

祝大家期末歐趴😢，也希望接下來的這個禮拜我可以過得開心一點。",做什麼事都提不起勁ಥ_ಥ,2021-01-05T15:22:22.820Z,2021-01-05T15:22:22.820Z,7,56,F,ncku,https://www.dcard.tw/f/ncku/p/235119419,dcard,post,已經心情低落一兩個月了做什麼事都沒有力氣不懂為什麼我每隔幾個月就要這樣子陷入低潮明明還有五科期末要考但是就是無法專注在上面食慾都好好的也不會想要去死一死但是就是不知道現在活著的意義是什麼有時候好希望自己其實有病這樣我就可以把這些狗屎爛蛋的低潮情緒都怪在那些心裡疾病上而不是承認我的人生就是活得很失敗祝大家期末歐趴也希望接下來的這個禮拜我可以過得開心一點,"['已經', '心情', '低落', '一兩', '個', '月', '了', '做', '什麼', '事', '都', '沒有', '力氣', '不', '懂', '為什麼', '我', '每隔', '幾', '個', '月', '就', '要', '這樣子', '陷入', '低潮', '明明', '還', '有', '五科', '期末', '要', '考', '但是', '就是', '無法', '專注', '在', '上面', '食慾', '都', '好好', '的', '也', '不會', '想要', '去', '死', '一', '死', '但是', '就是', '不', '知道', '現在', '活', '著', '的', '意義', '是', '什麼', '有時候', '好', '希望', '自己', '其實', '有病', '這樣', '我', '就', '可以', '把', '這些', '狗屎', '爛', '蛋', '的', '低潮', '情緒', '都', '怪', '在', '那些', '心', '裡', '疾病', '上', '而', '不', '是', '承認', '我', '的', '人生', '就是', '活', '得', '很', '失敗', '祝', '大家', '期末', '歐', '趴', '也', '希望', '接下來', '的', '這', '個', '禮拜', '我', '可以', '過', '得', '開心', '一點']","['已經', '心情', '低落', '一兩', '月', '做', '事', '力氣', '懂', '每隔', '月', '這樣子', '陷入', '低潮', '明明', '五科', '期末', '考', '無法', '專注', '上面', '食慾', '好好', '想要', '死', '死', '知道', '現在', '意義', '有時候', '好', '希望', '有病', '狗屎', '爛', '蛋', '低潮', '情緒', '心', '裡', '疾病', '承認', '人生', '失敗', '祝', '期末', '歐', '趴', '希望', '禮拜', '開心', '一點']",[],negative
170,235119280,"最近期末太瘋狂了 
結果早上睡過頭...沒去到這堂通識的最後一堂課😢
請問有去的同學老師今天安排了什麼活動呢
不知道有沒有點名或是加分加爆??

謝謝大家幫忙 讓我後悔一下沒去上課 嗚嗚...
祝期末歐趴！",音樂舞蹈戲劇請進,2021-01-05T15:06:56.844Z,2021-01-05T15:09:59.017Z,4,1,M,ncku,https://www.dcard.tw/f/ncku/p/235119280,dcard,post,最近期末太瘋狂了結果早上睡過頭沒去到這堂通識的最後一堂課請問有去的同學老師今天安排了什麼活動呢不知道有沒有點名或是加分加爆謝謝大家幫忙讓我後悔一下沒去上課嗚嗚祝期末歐趴,"['最近', '期末', '太', '瘋狂', '了', '結果', '早上', '睡', '過頭', '沒', '去到', '這', '堂', '通識', '的', '最後', '一', '堂', '課', '請問', '有', '去', '的', '同學', '老師', '今天', '安排', '了', '什麼', '活動', '呢', '不', '知道', '有沒有', '點名', '或是', '加分', '加爆', '謝謝', '大家', '幫忙', '讓', '我', '後悔', '一下', '沒', '去', '上課', '嗚嗚', '祝', '期末', '歐', '趴']","['最近', '期末', '太', '瘋狂', '早上', '睡', '過頭', '去到', '堂', '通識', '最後', '堂', '課', '請問', '同學', '老師', '今天', '安排', '活動', '知道', '有沒有', '點名', '加分', '加爆', '謝謝', '幫忙', '後悔', '一下', '上課', '嗚嗚', '祝', '期末', '歐', '趴']",[],positive
171,235119279,"之前在大學時
同樣辦活動
男生的工作量一定比女生大
營隊表演的東西危險性比女生高
搬的東西比女生重
如果今天是男生有力氣而且願意就沒話說
但是就算今天男生力氣比女生小且不願意做那些事 
還會被嗆沒用或是被罵裝死
等等 
同工同酬沒聽過嗎 
而且營隊還沒給我薪水 
我基本做功德還要被罵？
之後有雜誌要來我們系上拍宣傳照
老師問誰自願 
一些女生自願
老師居然要無關人員的男生搬桌子
不過最後我們反抗成功 
男生不動 
要拍的女生搬 
這基本上是對的 
老師居然不爽男生...
後來當兵時 
長官也不會說男生就應該怎樣 
會看狀況調整 
在營區休假時長官有跟我們說除非自願 不然沒人可以要你做事 
原本以為是幹話 
結果他們超重視這事情 
假日不開兵的伙食 
不過志願役還是讓我們加菜 
還是用拜託的語氣請我們洗餐桶
原本以為是成大比較古板 
沒有性別平等觀念 
軍隊都有這概念 
工作應該也有
結果工作上 
還是要求男生要搬重物開車 
不會還會被罵 
甚至影響長官對自己的評價 
可是當初面試跟簽約時 
沒有說我們工作內容包含搬重物跟開車 這情況下 
除非是搬自己辦公的文件 
或是自己開車執行自己業務 
其餘像是整理倉庫 
在外面跑業務搬東西 
根本不是需要做的 
做了也沒有加班費 
不知道有沒有違法勞動基準法 
而且這種事情要做 
男女都要做啊 
大家領一樣錢 
為啥非業務範圍事情 
男生要做比女生多呢
這種風氣不知何時才能改善",成大真的有辦法做到性別平等嗎,2021-01-05T15:06:47.631Z,2021-01-05T15:06:47.631Z,5,9,M,ncku,https://www.dcard.tw/f/ncku/p/235119279,dcard,post,之前在大學時同樣辦活動男生的工作量一定比女生大營隊表演的東西危險性比女生高搬的東西比女生重如果今天是男生有力氣而且願意就沒話說但是就算今天男生力氣比女生小且不願意做那些事還會被嗆沒用或是被罵裝死等等同工同酬沒聽過嗎而且營隊還沒給我薪水我基本做功德還要被罵之後有雜誌要來我們系上拍宣傳照老師問誰自願一些女生自願老師居然要無關人員的男生搬桌子不過最後我們反抗成功男生不動要拍的女生搬這基本上是對的老師居然不爽男生後來當兵時長官也不會說男生就應該怎樣會看狀況調整在營區休假時長官有跟我們說除非自願不然沒人可以要你做事原本以為是幹話結果他們超重視這事情假日不開兵的伙食不過志願役還是讓我們加菜還是用拜託的語氣請我們洗餐桶原本以為是成大比較古板沒有性別平等觀念軍隊都有這概念工作應該也有結果工作上還是要求男生要搬重物開車不會還會被罵甚至影響長官對自己的評價可是當初面試跟簽約時沒有說我們工作內容包含搬重物跟開車這情況下除非是搬自己辦公的文件或是自己開車執行自己業務其餘像是整理倉庫在外面跑業務搬東西根本不是需要做的做了也沒有加班費不知道有沒有違法勞動基準法而且這種事情要做男女都要做啊大家領一樣錢為啥非業務範圍事情男生要做比女生多呢這種風氣不知何時才能改善,"['之前', '在', '大學', '時', '同樣', '辦', '活動', '男生', '的', '工作量', '一定', '比', '女生', '大', '營隊', '表演', '的', '東西', '危險性', '比', '女生', '高搬', '的', '東西', '比', '女生', '重', '如果', '今天', '是', '男生', '有', '力氣', '而且', '願意', '就', '沒', '話說', '但是', '就算', '今天', '男生', '力氣', '比', '女生', '小', '且', '不', '願意', '做', '那些', '事', '還', '會', '被', '嗆', '沒用', '或是', '被', '罵', '裝', '死等', '等同', '工同酬', '沒', '聽', '過', '嗎', '而且', '營隊', '還', '沒', '給', '我', '薪水', '我', '基本', '做', '功德', '還要', '被', '罵', '之後', '有', '雜誌', '要', '來', '我們', '系', '上', '拍', '宣傳', '照', '老師', '問', '誰', '自願', '一些', '女生', '自願', '老師', '居然', '要', '無關', '人員', '的', '男生', '搬', '桌子', '不過', '最後', '我們', '反抗', '成功', '男生', '不', '動', '要', '拍', '的', '女生', '搬', '這', '基本', '上', '是', '對', '的', '老師', '居然', '不', '爽', '男生', '後來', '當兵', '時', '長官', '也', '不會', '說', '男生', '就', '應該', '怎樣', '會', '看', '狀況', '調整', '在', '營區', '休假', '時', '長官', '有', '跟', '我們', '說', '除非', '自願', '不然', '沒', '人', '可以', '要', '你', '做', '事', '原本', '以為', '是', '幹話', '結果', '他們', '超重', '視', '這', '事情', '假日', '不', '開兵', '的', '伙食', '不過', '志願', '役', '還是', '讓', '我們', '加菜', '還是', '用', '拜託', '的', '語氣', '請', '我們', '洗餐桶', '原本', '以為', '是', '成大', '比較', '古板', '沒有', '性別', '平等', '觀念', '軍隊', '都', '有', '這', '概念', '工作', '應該', '也', '有', '結果', '工作', '上', '還是', '要求', '男生', '要', '搬', '重物', '開車', '不會', '還', '會', '被', '罵', '甚至', '影響', '長官', '對', '自己', '的', '評價', '可是', '當初', '面試', '跟', '簽約', '時', '沒有', '說', '我們', '工作', '內容', '包含', '搬', '重物', '跟', '開車', '這', '情況', '下', '除非', '是', '搬', '自己', '辦公', '的', '文件', '或是', '自己', '開車', '執行', '自己', '業務', '其餘', '像是', '整理', '倉庫', '在', '外面', '跑', '業務', '搬', '東西', '根本', '不', '是', '需要', '做', '的', '做', '了', '也', '沒有', '加班費', '不', '知道', '有沒有', '違法', '勞動', '基準法', '而且', '這', '種', '事情', '要', '做', '男女', '都', '要', '做', '啊', '大家', '領', '一樣', '錢', '為啥', '非', '業務', '範圍', '事情', '男生', '要', '做', '比', '女生', '多', '呢', '這', '種', '風氣', '不', '知', '何時', '才能', '改善']","['之前', '大學', '時', '同樣', '辦', '活動', '男生', '工作量', '一定', '女生', '營隊', '表演', '東西', '危險性', '女生', '高搬', '東西', '女生', '重', '今天', '男生', '力氣', '願意', '今天', '男生', '力氣', '女生', '小', '願意', '做', '事', '嗆', '沒用', '罵', '裝', '死等', '等同', '工同酬', '聽', '營隊', '薪水', '做', '功德', '還要', '罵', '之後', '雜誌', '系', '拍', '宣傳', '老師', '問', '自願', '一些', '女生', '自願', '老師', '無關', '人員', '男生', '搬', '桌子', '最後', '反抗', '成功', '男生', '動', '拍', '女生', '搬', '老師', '爽', '男生', '當兵', '時', '長官', '說', '男生', '應該', '狀況', '調整', '營區', '休假', '時', '長官', '說', '自願', '人', '做', '事', '原本', '以為', '幹話', '超重', '視', '事情', '假日', '開兵', '伙食', '志願', '役', '加菜', '拜託', '語氣', '請', '洗餐桶', '原本', '以為', '成大', '比較', '古板', '性別', '平等', '觀念', '軍隊', '概念', '工作', '應該', '工作', '要求', '男生', '搬', '重物', '開車', '罵', '影響', '長官', '評價', '當初', '面試', '簽約', '時', '說', '工作', '內容', '包含', '搬', '重物', '開車', '情況', '下', '搬', '辦公', '文件', '開車', '執行', '業務', '像是', '整理', '倉庫', '外面', '跑', '業務', '搬', '東西', '根本', '需要', '做', '做', '加班費', '知道', '有沒有', '違法', '勞動', '基準法', '種', '事情', '做', '男女', '做', '領', '錢', '為啥', '非', '業務', '範圍', '事情', '男生', '做', '女生', '種', '風氣', '知', '改善']","['男生', '做', '女生']",negative
172,235119197,"假如加分的小考只寫過一次
期末寫起來可能60左右
最後分數會是多少啊……",請問有修過身體結構與功能的人嗎？,2021-01-05T14:58:08.418Z,2021-01-05T14:58:08.418Z,3,0,M,ncku,https://www.dcard.tw/f/ncku/p/235119197,dcard,post,假如加分的小考只寫過一次期末寫起來可能左右最後分數會是多少啊,"['假如', '加分', '的', '小考', '只', '寫', '過', '一', '次', '期末', '寫起來', '可能', '左右', '最後', '分數', '會', '是', '多少', '啊']","['加分', '小考', '只', '寫', '次', '期末', '寫起來', '左右', '最後', '分數']",[],neutral
173,235119176,"我記得
某系上教授
那個選擇題齁
也大概都抓國考的
沒說是誰喔
反正大家都公務員
領錢辦事嗎哈哈",出國考題正常低,2021-01-05T14:54:47.112Z,2021-01-05T14:54:47.112Z,4,4,M,ncku,https://www.dcard.tw/f/ncku/p/235119176,dcard,post,我記得某系上教授那個選擇題齁也大概都抓國考的沒說是誰喔反正大家都公務員領錢辦事嗎哈哈,"['我', '記得', '某', '系', '上', '教授', '那', '個', '選擇題', '齁', '也', '大概', '都', '抓', '國', '考', '的', '沒', '說', '是', '誰', '喔', '反正', '大家', '都', '公務員', '領', '錢', '辦事', '嗎', '哈哈']","['記得', '系', '教授', '選擇題', '齁', '抓', '國', '考', '說', '反正', '公務員', '領', '錢', '辦事']",[],positive
174,235119129,"已經讀了一小時
來看看只讀一個晚上能拿多少分www",通識心理學是不打算放最後兩次的PPT嗎,2021-01-05T14:48:06.821Z,2021-01-05T14:48:06.821Z,14,2,M,ncku,https://www.dcard.tw/f/ncku/p/235119129,dcard,post,已經讀了一小時來看看只讀一個晚上能拿多少分,"['已經', '讀', '了', '一', '小時', '來', '看看', '只', '讀', '一', '個', '晚上', '能', '拿', '多少', '分']","['已經', '讀', '小時', '看看', '只', '讀', '晚上', '分']",[],neutral
175,235119077,"想請問各位期末考卷會發回來嗎，如果考完幾天後還有課。
不然期中我看一堆人改錯或是加錯的，想要檢查一下比較安心。",期末考卷,2021-01-05T14:41:24.349Z,2021-01-05T14:41:24.349Z,3,2,M,ncku,https://www.dcard.tw/f/ncku/p/235119077,dcard,post,想請問各位期末考卷會發回來嗎如果考完幾天後還有課不然期中我看一堆人改錯或是加錯的想要檢查一下比較安心,"['想', '請問', '各位', '期末', '考卷', '會', '發回', '來', '嗎', '如果', '考完', '幾', '天', '後', '還', '有', '課', '不然', '期中', '我', '看', '一', '堆', '人', '改錯', '或是', '加錯', '的', '想要', '檢查', '一下', '比較', '安心']","['想', '請問', '期末', '考卷', '發回', '考完', '天', '後', '課', '期中', '堆', '人', '改錯', '加錯', '想要', '檢查', '一下', '比較', '安心']",[],positive
176,235119067,"考完期末考了
有人要來互相取暖嗎==",數學系微積分,2021-01-05T14:40:48.216Z,2021-01-05T14:40:48.216Z,48,8,M,ncku,https://www.dcard.tw/f/ncku/p/235119067,dcard,post,考完期末考了有人要來互相取暖嗎,"['考完', '期末考', '了', '有', '人', '要', '來', '互相', '取暖', '嗎']","['考完', '期末考', '人', '取暖']",[],neutral
177,235118839,"應該在光復校區，鏈子銀色，墜飾是一顆黑桃，上面刻一個字母Q。
拜託有看到的回一下🥺
快放假怕找不會來😭",有人看到一條腳鍊嗎？,2021-01-05T14:13:38.494Z,2021-01-06T04:34:12.952Z,5,3,F,ncku,https://www.dcard.tw/f/ncku/p/235118839,dcard,post,應該在光復校區鏈子銀色墜飾是一顆黑桃上面刻一個字母拜託有看到的回一下快放假怕找不會來,"['應該', '在', '光復', '校區', '鏈子', '銀色', '墜飾', '是', '一', '顆', '黑桃', '上面', '刻', '一', '個', '字母', '拜託', '有', '看到', '的', '回', '一下', '快', '放假', '怕', '找', '不會', '來']","['應該', '光復', '校區', '鏈子', '銀色', '墜飾', '顆', '黑桃', '上面', '刻', '字母', '拜託', '看到', '回', '一下', '放假', '找']",[],negative
178,235118813,"我剛剛翻了一下畢聯會的粉專，看到這篇文
https://i.imgur.com/1ePtxOd.jpg
感覺設計得比其他篇好很多欸
跟其他篇是同一個人設計的嗎？",成大畢聯會美術設計有進步？,2021-01-05T14:09:46.636Z,2021-01-05T14:12:03.636Z,5,28,F,ncku,https://www.dcard.tw/f/ncku/p/235118813,dcard,post,我剛剛翻了一下畢聯會的粉專看到這篇文感覺設計得比其他篇好很多欸跟其他篇是同一個人設計的嗎,"['我', '剛剛', '翻', '了', '一下', '畢聯會', '的', '粉', '專', '看到', '這', '篇', '文', '感覺', '設計', '得', '比', '其他', '篇', '好', '很多', '欸', '跟', '其他', '篇', '是', '同一', '個人', '設計', '的', '嗎']","['剛剛', '翻', '一下', '畢聯會', '粉', '專', '看到', '篇', '文', '感覺', '設計', '篇', '好', '欸', '篇', '同一', '設計']",[],positive
