0,235156027,兵兵蹦蹦，時不時有撞擊聲，有掛嗎？  我怕怕,光二頂樓,2021-01-11T18:38:27.456Z,2021-01-11T18:38:27.456Z,1,0,M,ncku,https://www.dcard.tw/f/ncku/p/235156027,dcard,post,兵兵蹦蹦時不時有撞擊聲有掛嗎我怕怕,"['兵兵', '蹦蹦', '時', '不時', '有', '撞擊聲', '有', '掛', '嗎', '我', '怕怕']","['兵兵', '蹦蹦', '時', '撞擊聲', '掛', '怕怕']",[],negative
1,235155849,"成績還看的過去
上了一堆不知道在幹嘛的課
學完還是不知道能拿來幹嘛
想過可能是對科系沒興趣
但又不知道要轉到什麼系畢竟都沒興趣
大家都怎麼遇到有興趣讓你想要努力讀下去的科系的",上大學後還是很廢物,2021-01-11T17:49:57.402Z,2021-01-11T17:50:12.527Z,2,4,M,ncku,https://www.dcard.tw/f/ncku/p/235155849,dcard,post,成績還看的過去上了一堆不知道在幹嘛的課學完還是不知道能拿來幹嘛想過可能是對科系沒興趣但又不知道要轉到什麼系畢竟都沒興趣大家都怎麼遇到有興趣讓你想要努力讀下去的科系的,"['成績', '還', '看', '的', '過去', '上', '了', '一', '堆', '不', '知道', '在', '幹嘛', '的', '課', '學完', '還是', '不', '知道', '能', '拿來', '幹嘛', '想', '過', '可能', '是', '對', '科系', '沒', '興趣', '但', '又', '不', '知道', '要', '轉到', '什麼', '系', '畢竟', '都', '沒', '興趣', '大家', '都', '怎麼', '遇到', '有', '興趣', '讓', '你', '想要', '努力', '讀', '下去', '的', '科系', '的']","['成績', '過去', '堆', '知道', '幹嘛', '課', '學完', '知道', '拿來', '幹嘛', '想', '科系', '興趣', '知道', '轉到', '系', '興趣', '遇到', '興趣', '想要', '努力', '讀', '下去', '科系']",[],positive
2,235155762,"試問哪裡有比酷拉皮卡還難下船的暈船仔
https://i.imgur.com/0WaQRZF.jpg",QQ,2021-01-11T17:31:46.268Z,2021-01-11T17:31:46.268Z,2,0,F,ncku,https://www.dcard.tw/f/ncku/p/235155762,dcard,post,試問哪裡有比酷拉皮卡還難下船的暈船仔,"['試問', '哪裡', '有', '比', '酷', '拉皮卡', '還', '難', '下', '船', '的', '暈船', '仔']","['試問', '哪裡', '酷', '拉皮卡', '難', '下', '船', '暈船', '仔']",[],neutral
3,235155501,"每天晚上12點左右都要敲敲敲敲敲
你有什麼問題？",光一1027不要再敲了,2021-01-11T16:43:42.049Z,2021-01-11T16:43:42.049Z,4,1,M,ncku,https://www.dcard.tw/f/ncku/p/235155501,dcard,post,每天晚上點左右都要敲敲敲敲敲你有什麼問題,"['每', '天', '晚上點', '左右', '都', '要', '敲', '敲敲敲敲', '你', '有', '什麼', '問題']","['天', '晚上點', '左右', '敲', '敲敲敲敲', '問題']",[],negative
4,235155490,"請問
企管系出來的
以後到底可以幹嘛?
難道要繼續辦活動嗎?",企管系畢業到底可以幹嘛?,2021-01-11T16:41:48.133Z,2021-01-11T16:41:48.133Z,3,0,M,ncku,https://www.dcard.tw/f/ncku/p/235155490,dcard,post,請問企管系出來的以後到底可以幹嘛難道要繼續辦活動嗎,"['請問', '企管系', '出來', '的', '以後', '到底', '可以', '幹嘛', '難道', '要', '繼續', '辦', '活動', '嗎']","['請問', '企管系', '以後', '幹嘛', '繼續', '辦', '活動']",[],neutral
5,235155284,"幹期末考的好難 怕過不了啦
救我～～～～
哭哭",法律系 最小平方法,2021-01-11T16:04:10.673Z,2021-01-11T16:04:10.673Z,1,0,M,ncku,https://www.dcard.tw/f/ncku/p/235155284,dcard,post,幹期末考的好難怕過不了啦救我哭哭,"['幹', '期末考', '的', '好', '難', '怕', '過不了', '啦', '救', '我', '哭', '哭']","['幹', '期末考', '好', '難', '過不了', '救', '哭', '哭']",[],neutral
6,235154815,"典典的親屬繼承到底會不會當一堆人啊
他期末當天很高興的說
但聽說好像有人7分？
完蛋了😭",典典親屬法,2021-01-11T14:51:56.071Z,2021-01-11T14:51:56.071Z,1,1,F,ncku,https://www.dcard.tw/f/ncku/p/235154815,dcard,post,典典的親屬繼承到底會不會當一堆人啊他期末當天很高興的說但聽說好像有人分完蛋了,"['典典', '的', '親屬', '繼承', '到底', '會不會', '當', '一', '堆', '人', '啊', '他', '期末', '當天', '很', '高興', '的', '說', '但', '聽說', '好像', '有', '人', '分', '完蛋', '了']","['典典', '親屬', '繼承', '會不會', '堆', '人', '期末', '當天', '高興', '說', '聽說', '好像', '人', '分', '完蛋']",[],negative
7,235154809,"如題，剛才在大學路與長榮路交叉的十字路口等紅綠燈時，碰見一個口角。

先說明一下，該十字路口紅綠燈採用行人專用號誌，簡單來說，橫向車流先走，其次是縱向車流，最後有一段時間是行人專用(此時橫縱向車流皆不可行動)。我相信大家應該經常遇見這樣的十字路口，也不太需要我這臭魚爛蝦般的科普。

扯遠了，事情經過非常簡短，與我同時在等紅綠燈的是一對年輕的情侶。
等到行人號誌綠燈時，男方莫名其妙的突然非常興奮，並跟女友說，""我們台北市都是這樣的紅綠燈，沒想到台南居然也有。"" 聽到這話，我十分的震驚(後面會詳加說明原因)，與我同樣震驚的是他的女友。他女友非常不高興並說，""自以為什麼啦！你以為什麼東西就你天龍國有而已嗎？"" 沒想到雙方不歡而散。

這位老兄，要不要老夫給你做個狗牌讓你掛著，上面寫""我是台北市人。""？
你說你講的那是人話嗎？現在都2021年了，你是在瞧不起誰？
還是你以為到台南會在大學路上看到水牛與土著？
我猜你的女朋友估計是忍很久了，說不定在上個路口你還在說，""哇！沒想到台南居然有紅綠燈與7-11ㄟ。""。
你再不好好收斂你那會讓我發3000個導致本文被刪詞彙的扭曲價值觀。你女朋友沒準哪一天就會笑著跟你說，""親愛的，你的那頂綠帽，老娘已經幫你織好了，就等你戴了呦～""。
泥馬的！多半就是因為有你這種人，別人才會對我們台北人戴有色眼鏡。",十字路口的口角,2021-01-11T14:51:13.121Z,2021-01-11T14:51:13.121Z,7,5,M,ncku,https://www.dcard.tw/f/ncku/p/235154809,dcard,post,如題剛才在大學路與長榮路交叉的十字路口等紅綠燈時碰見一個口角先說明一下該十字路口紅綠燈採用行人專用號誌簡單來說橫向車流先走其次是縱向車流最後有一段時間是行人專用此時橫縱向車流皆不可行動我相信大家應該經常遇見這樣的十字路口也不太需要我這臭魚爛蝦般的科普扯遠了事情經過非常簡短與我同時在等紅綠燈的是一對年輕的情侶等到行人號誌綠燈時男方莫名其妙的突然非常興奮並跟女友說我們台北市都是這樣的紅綠燈沒想到台南居然也有聽到這話我十分的震驚後面會詳加說明原因與我同樣震驚的是他的女友他女友非常不高興並說自以為什麼啦你以為什麼東西就你天龍國有而已嗎沒想到雙方不歡而散這位老兄要不要老夫給你做個狗牌讓你掛著上面寫我是台北市人你說你講的那是人話嗎現在都年了你是在瞧不起誰還是你以為到台南會在大學路上看到水牛與土著我猜你的女朋友估計是忍很久了說不定在上個路口你還在說哇沒想到台南居然有紅綠燈與你再不好好收斂你那會讓我發個導致本文被刪詞彙的扭曲價值觀你女朋友沒準哪一天就會笑著跟你說親愛的你的那頂綠帽老娘已經幫你織好了就等你戴了呦泥馬的多半就是因為有你這種人別人才會對我們台北人戴有色眼鏡,"['如', '題', '剛才', '在', '大學路', '與', '長榮路', '交叉', '的', '十字路口', '等', '紅綠燈', '時', '碰見', '一', '個', '口角', '先', '說明', '一下', '該', '十字路口', '紅綠燈', '採用', '行人', '專用', '號誌', '簡單', '來', '說', '橫向', '車流', '先', '走', '其次', '是', '縱向', '車流', '最後', '有', '一段', '時間', '是', '行人', '專用', '此', '時', '橫', '縱向', '車流', '皆', '不可', '行動', '我', '相信', '大家', '應該', '經常', '遇見', '這樣', '的', '十字路口', '也', '不', '太', '需要', '我', '這', '臭魚爛蝦', '般', '的', '科普', '扯遠', '了', '事情', '經過', '非常', '簡短', '與', '我', '同時', '在', '等', '紅綠燈', '的', '是', '一', '對', '年輕', '的', '情侶', '等到', '行人', '號誌', '綠燈', '時', '男方', '莫名其妙', '的', '突然', '非常', '興奮', '並', '跟', '女友', '說', '我們', '台北市', '都', '是', '這樣', '的', '紅綠燈', '沒想到', '台南', '居然', '也', '有', '聽到', '這', '話', '我', '十分', '的', '震驚', '後面', '會', '詳加', '說明', '原因', '與', '我', '同樣', '震驚', '的', '是', '他', '的', '女友', '他', '女友', '非常', '不', '高興', '並', '說', '自以為', '什麼', '啦', '你', '以為', '什麼', '東西', '就', '你', '天龍', '國有', '而已', '嗎', '沒想到', '雙方', '不歡而散', '這', '位', '老兄', '要不要', '老夫', '給', '你', '做', '個', '狗牌', '讓', '你', '掛', '著', '上面', '寫', '我', '是', '台北市', '人', '你', '說', '你', '講', '的', '那', '是', '人話', '嗎', '現在', '都', '年', '了', '你', '是', '在', '瞧不起', '誰', '還是', '你', '以為', '到', '台南', '會', '在', '大學路', '上', '看到', '水牛', '與', '土著', '我', '猜', '你', '的', '女朋友', '估計', '是', '忍', '很', '久', '了', '說不定', '在', '上', '個', '路口', '你', '還', '在', '說', '哇', '沒想到', '台南', '居然', '有', '紅綠燈', '與', '你', '再', '不', '好好', '收斂', '你', '那會', '讓', '我', '發', '個', '導致', '本文', '被', '刪', '詞彙', '的', '扭曲', '價值觀', '你', '女朋友', '沒', '準', '哪', '一', '天', '就', '會', '笑', '著', '跟', '你', '說', '親愛的', '你', '的', '那', '頂', '綠帽', '老娘', '已經', '幫', '你', '織', '好了', '就', '等', '你', '戴', '了', '呦泥', '馬的', '多半', '就是', '因為', '有', '你', '這', '種', '人', '別', '人才', '會', '對', '我們', '台北人', '戴', '有色', '眼鏡']","['題', '大學路', '長榮路', '交叉', '十字路口', '紅綠燈', '時', '碰見', '口角', '先', '說明', '一下', '十字路口', '紅綠燈', '採用', '行人', '專用', '號誌', '簡單', '說', '橫向', '車流', '先', '走', '縱向', '車流', '最後', '一段', '時間', '行人', '專用', '時', '橫', '縱向', '車流', '皆', '不可', '行動', '相信', '應該', '遇見', '十字路口', '太', '需要', '臭魚爛蝦', '般', '科普', '扯遠', '事情', '簡短', '紅綠燈', '年輕', '情侶', '行人', '號誌', '綠燈', '時', '男方', '莫名其妙', '突然', '興奮', '女友', '說', '台北市', '紅綠燈', '沒想到', '台南', '聽到', '話', '十分', '震驚', '後面', '詳加', '說明', '原因', '同樣', '震驚', '女友', '女友', '高興', '說', '自以為', '以為', '東西', '天龍', '國有', '沒想到', '雙方', '不歡而散', '位', '老兄', '要不要', '老夫', '做', '狗牌', '掛', '上面', '寫', '台北市', '人', '說', '講', '人話', '現在', '年', '瞧不起', '以為', '台南', '大學路', '看到', '水牛', '土著', '猜', '女朋友', '估計', '忍', '久', '說不定', '路口', '說', '沒想到', '台南', '紅綠燈', '再', '好好', '收斂', '那會', '發', '導致', '本文', '刪', '詞彙', '扭曲', '價值觀', '女朋友', '準', '天', '笑', '說', '親愛的', '頂', '綠帽', '老娘', '已經', '幫', '織', '好了', '戴', '呦泥', '馬的', '多半', '種', '人', '人才', '台北人', '戴', '有色', '眼鏡']","['說', '紅綠燈', '十字路口']",negative
8,235154783,真的很神奇呢，10次有6次下去看衣服都還是濕濕的呢😊😊怎麼那麼多人都喜歡把別人沒烘完的衣服拿起來呢，真的是快氣死,宿舍烘衣機,2021-01-11T14:48:14.206Z,2021-01-11T14:48:14.206Z,10,1,M,ncku,https://www.dcard.tw/f/ncku/p/235154783,dcard,post,真的很神奇呢次有次下去看衣服都還是濕濕的呢怎麼那麼多人都喜歡把別人沒烘完的衣服拿起來呢真的是快氣死,"['真的', '很', '神奇', '呢', '次', '有', '次', '下去', '看', '衣服', '都', '還是', '濕濕', '的', '呢', '怎麼', '那麼多', '人', '都', '喜歡', '把', '別人', '沒', '烘完', '的', '衣服', '拿起來', '呢', '真的', '是', '快', '氣死']","['真的', '神奇', '次', '次', '下去', '衣服', '濕濕', '那麼多', '人', '喜歡', '烘完', '衣服', '拿起來', '真的', '氣死']",[],negative
9,235154637,請問貴系的葉如萍老師上課與評分方式如何？小弟下學期想要上那位老師的選修課，但這門課好像是第一次開(?)，所以找不到相關的資訊，希望有人願意回答，謝謝🥺,都計系請進,2021-01-11T14:28:13.699Z,2021-01-11T14:28:13.699Z,3,1,M,ncku,https://www.dcard.tw/f/ncku/p/235154637,dcard,post,請問貴系的葉如萍老師上課與評分方式如何小弟下學期想要上那位老師的選修課但這門課好像是第一次開所以找不到相關的資訊希望有人願意回答謝謝,"['請問', '貴', '系', '的', '葉如萍', '老師', '上課', '與', '評分', '方式', '如何', '小弟', '下', '學期', '想要', '上', '那', '位', '老師', '的', '選修課', '但', '這', '門', '課', '好像', '是', '第一', '次', '開', '所以', '找', '不', '到', '相關', '的', '資訊', '希望', '有', '人', '願意', '回答', '謝謝']","['請問', '貴', '系', '葉如萍', '老師', '上課', '評分', '方式', '小弟', '下', '學期', '想要', '位', '老師', '選修課', '門', '課', '好像', '第一', '次', '開', '找', '相關', '資訊', '希望', '人', '願意', '回答', '謝謝']",[],positive
10,235154575,"一直以來都覺得肩頸痠痛
胸椎也有側彎
高低肩也很明顯....
上網查了很多店 發現評價都很兩極
誠徵大家推薦的整骨店🙌
希望有實際去過真的推薦的店，謝謝大家🙏",台南整骨,2021-01-11T14:18:51.293Z,2021-01-11T14:19:32.701Z,7,8,M,ncku,https://www.dcard.tw/f/ncku/p/235154575,dcard,post,一直以來都覺得肩頸痠痛胸椎也有側彎高低肩也很明顯上網查了很多店發現評價都很兩極誠徵大家推薦的整骨店希望有實際去過真的推薦的店謝謝大家,"['一直', '以來', '都', '覺得', '肩頸', '痠痛', '胸椎', '也', '有', '側彎', '高低', '肩', '也', '很', '明顯', '上網', '查', '了', '很多', '店', '發現', '評價', '都', '很', '兩極', '誠徵', '大家', '推薦', '的', '整骨店', '希望', '有', '實際', '去', '過', '真的', '推薦', '的', '店', '謝謝', '大家']","['一直', '以來', '覺得', '肩頸', '痠痛', '胸椎', '側彎', '肩', '明顯', '上網', '查', '店', '發現', '評價', '兩極', '誠徵', '推薦', '整骨店', '希望', '實際', '真的', '推薦', '店', '謝謝']",[],positive
11,235154421,"小弟想要跨領域學電機的部分 請問哪些東西是必須學的呢？（我是工學院ㄉ
我想說先把線代 離散 電子 先修一修這樣",電機系ㄉ學霸們進來幫幫忙,2021-01-11T13:55:21.558Z,2021-01-11T13:55:21.558Z,12,2,M,ncku,https://www.dcard.tw/f/ncku/p/235154421,dcard,post,小弟想要跨領域學電機的部分請問哪些東西是必須學的呢我是工學院我想說先把線代離散電子先修一修這樣,"['小弟', '想要', '跨', '領域', '學', '電機', '的', '部分', '請問', '哪些', '東西', '是', '必須', '學', '的', '呢', '我', '是', '工學院', '我', '想', '說', '先', '把', '線代', '離散', '電子', '先修', '一', '修', '這樣']","['小弟', '想要', '跨', '領域', '學', '電機', '部分', '請問', '東西', '學', '工學院', '想', '說', '先', '線代', '離散', '電子', '先修', '修']",[],negative
12,235154265,"這門課是選修的 不知道要不要選
請問這門課如何 會不會很硬  分數給的甜嗎",工科系的線性代數,2021-01-11T13:30:42.291Z,2021-01-11T13:30:42.291Z,7,2,M,ncku,https://www.dcard.tw/f/ncku/p/235154265,dcard,post,這門課是選修的不知道要不要選請問這門課如何會不會很硬分數給的甜嗎,"['這', '門', '課', '是', '選修', '的', '不', '知道', '要不要', '選', '請問', '這', '門', '課', '如何', '會不會', '很', '硬', '分數', '給', '的', '甜', '嗎']","['門', '課', '選修', '知道', '要不要', '選', '請問', '門', '課', '會不會', '硬', '分數', '甜']",[],positive
13,235152996,"每次二階段選課都搶不到
能登進去已經過5 6分了 都搶光了

會不會去網咖用光纖網路才比較容易選到課啊
想請教各位大大的經驗

附上網測測試
https://www.speedtest.net/",各位選課的網路+硬體設備如何?,2021-01-11T09:44:28.340Z,2021-01-11T12:45:38.255Z,23,8,M,ncku,https://www.dcard.tw/f/ncku/p/235152996,dcard,post,每次二階段選課都搶不到能登進去已經過分了都搶光了會不會去網咖用光纖網路才比較容易選到課啊想請教各位大大的經驗附上網測測試,"['每', '次', '二', '階段', '選課', '都', '搶不到', '能', '登', '進去', '已經', '過分', '了', '都', '搶光', '了', '會不會', '去', '網咖用', '光纖', '網路', '才', '比較', '容易', '選到', '課', '啊', '想', '請教', '各位', '大大', '的', '經驗', '附上', '網測', '測試']","['次', '階段', '選課', '搶不到', '登', '已經', '過分', '搶光', '會不會', '網咖用', '光纖', '網路', '比較', '容易', '選到', '課', '想', '請教', '經驗', '附上', '網測', '測試']",[],positive
14,235152807,"最近一直在二手版上看到:「鑰匙沒拔，幫你放到前面的置物籃。」隨之附上的是機車的圖片，車牌地點也告訴大家。
阿你這樣發，是想讓全世界都知道他鑰匙沒拔，可以去牽來騎嗎？鑰匙沒拔，你要就幫他拔掉放到前面，要不就裝作沒看到，妳Po文出來說妳幫他拔鑰匙，豈不是造成他機車更容易被偷嗎？
拔就拔，Po什麼文，是想邀功嗎？那你差一個動作欸！就是把經緯度標出來，讓人更知道車在哪，去哪牽👍👍👍",這是WeShare?,2021-01-11T09:17:04.159Z,2021-01-11T16:59:16.501Z,7,15,M,ncku,https://www.dcard.tw/f/ncku/p/235152807,dcard,post,最近一直在二手版上看到鑰匙沒拔幫你放到前面的置物籃隨之附上的是機車的圖片車牌地點也告訴大家阿你這樣發是想讓全世界都知道他鑰匙沒拔可以去牽來騎嗎鑰匙沒拔你要就幫他拔掉放到前面要不就裝作沒看到妳文出來說妳幫他拔鑰匙豈不是造成他機車更容易被偷嗎拔就拔什麼文是想邀功嗎那你差一個動作欸就是把經緯度標出來讓人更知道車在哪去哪牽,"['最近', '一直', '在', '二手版', '上', '看到', '鑰匙', '沒', '拔', '幫', '你', '放到', '前面', '的', '置物籃', '隨之', '附上', '的', '是', '機車', '的', '圖片', '車牌', '地點', '也', '告訴', '大家', '阿', '你', '這樣', '發', '是', '想', '讓', '全', '世界', '都', '知道', '他', '鑰匙', '沒', '拔', '可以', '去', '牽', '來騎', '嗎', '鑰匙', '沒', '拔', '你', '要', '就', '幫', '他', '拔掉', '放到', '前面', '要不', '就', '裝作', '沒', '看到', '妳', '文', '出來', '說', '妳', '幫', '他', '拔', '鑰匙', '豈不是', '造成', '他', '機車', '更', '容易', '被', '偷', '嗎', '拔', '就', '拔', '什麼', '文', '是', '想', '邀功', '嗎', '那', '你', '差', '一', '個', '動作', '欸', '就是', '把', '經緯度', '標出', '來', '讓', '人', '更', '知道', '車', '在', '哪', '去', '哪', '牽']","['最近', '一直', '二手版', '看到', '鑰匙', '拔', '幫', '放到', '前面', '置物籃', '隨之', '附上', '機車', '圖片', '車牌', '地點', '告訴', '發', '想', '全', '世界', '知道', '鑰匙', '拔', '牽', '來騎', '鑰匙', '拔', '幫', '拔掉', '放到', '前面', '裝作', '看到', '妳', '文', '說', '妳', '幫', '拔', '鑰匙', '豈不是', '造成', '機車', '容易', '偷', '拔', '拔', '文', '想', '邀功', '差', '動作', '欸', '經緯度', '標出', '人', '知道', '車', '牽']",[],negative
15,235152169,"寫了老半天沒drama、沒系名沒關鍵字
看完只覺的狗血廢文
看來大家壓力都很大
不如辦個期末戀愛幻想廢文大賽
有看點的給讚
只會堆砌符號的給怒
怒最多的還是先告白被甩幾次再來發文",是不是開辦個戀愛幻想文大賽,2021-01-11T07:17:27.044Z,2021-01-11T07:17:27.044Z,7,4,M,ncku,https://www.dcard.tw/f/ncku/p/235152169,dcard,post,寫了老半天沒沒系名沒關鍵字看完只覺的狗血廢文看來大家壓力都很大不如辦個期末戀愛幻想廢文大賽有看點的給讚只會堆砌符號的給怒怒最多的還是先告白被甩幾次再來發文,"['寫', '了', '老半天', '沒沒', '系', '名', '沒', '關鍵字', '看完', '只', '覺', '的', '狗血', '廢文', '看來', '大家', '壓力', '都', '很', '大', '不如', '辦', '個', '期末', '戀愛', '幻想', '廢文', '大賽', '有', '看', '點', '的', '給', '讚', '只', '會', '堆砌', '符號', '的', '給', '怒怒', '最多', '的', '還是', '先', '告白', '被', '甩', '幾', '次', '再', '來', '發文']","['寫', '老半天', '沒沒', '系', '名', '關鍵字', '看完', '只', '覺', '狗血', '廢文', '壓力', '辦', '期末', '戀愛', '幻想', '廢文', '大賽', '點', '讚', '只', '堆砌', '符號', '怒怒', '最多', '先', '告白', '甩', '次', '再', '發文']",[],negative
16,235151932,"乾，把別人晾的衣服全部推到旁邊擠在一起是怎樣？
別人的衣服不用晾是不是？
沒位置就去找別的地方晾啦乾！
下次再讓我看到我就把你的衣服丟回收箱！
-
順便靠杯晾手洗衣服又不脫水的智障
水一直滴很噁心
你如果嫌脫水機太多人用很噁心就他媽去健身房練成巨巨徒手把衣服擰乾！
水一直滴到地板，地板會壞掉！
這裡是大學宿舍不是你的媽寶小窩
用點腦袋可以嗎？
#晾衣場 #公德心 #脫水機 #地板 #媽寶小窩",光一九樓曬衣場的智障,2021-01-11T06:30:35.137Z,2021-01-11T06:30:35.137Z,5,7,M,ncku,https://www.dcard.tw/f/ncku/p/235151932,dcard,post,乾把別人晾的衣服全部推到旁邊擠在一起是怎樣別人的衣服不用晾是不是沒位置就去找別的地方晾啦乾下次再讓我看到我就把你的衣服丟回收箱順便靠杯晾手洗衣服又不脫水的智障水一直滴很噁心你如果嫌脫水機太多人用很噁心就他媽去健身房練成巨巨徒手把衣服擰乾水一直滴到地板地板會壞掉這裡是大學宿舍不是你的媽寶小窩用點腦袋可以嗎晾衣場公德心脫水機地板媽寶小窩,"['乾', '把', '別人', '晾', '的', '衣服', '全部', '推到', '旁邊', '擠', '在一起', '是', '怎樣', '別人', '的', '衣服', '不用', '晾', '是', '不', '是', '沒', '位置', '就', '去', '找', '別的', '地方', '晾', '啦', '乾', '下', '次', '再', '讓', '我', '看到', '我', '就', '把', '你', '的', '衣服', '丟', '回收', '箱', '順便', '靠', '杯晾手', '洗衣服', '又', '不', '脫水', '的', '智障水', '一直', '滴', '很', '噁心', '你', '如果', '嫌', '脫水機', '太多', '人', '用', '很', '噁心', '就', '他媽', '去', '健身房', '練成', '巨巨', '徒手', '把', '衣服', '擰乾水', '一直', '滴到', '地板', '地板', '會', '壞掉', '這裡', '是', '大學', '宿舍', '不', '是', '你', '的', '媽', '寶小窩', '用', '點', '腦袋', '可以', '嗎', '晾衣場', '公德心', '脫水機', '地板', '媽', '寶小窩']","['乾', '晾', '衣服', '全部', '推到', '旁邊', '擠', '在一起', '衣服', '不用', '晾', '位置', '找', '地方', '晾', '乾', '下', '次', '再', '看到', '衣服', '丟', '回收', '箱', '順便', '杯晾手', '洗衣服', '脫水', '智障水', '一直', '滴', '噁心', '嫌', '脫水機', '太多', '人', '噁心', '他媽', '健身房', '練成', '巨巨', '徒手', '衣服', '擰乾水', '一直', '滴到', '地板', '地板', '壞掉', '這裡', '大學', '宿舍', '媽', '寶小窩', '點', '腦袋', '晾衣場', '公德心', '脫水機', '地板', '媽', '寶小窩']",[],negative
