0,235134534,"拜託你沒有唸書就不要想要靠別人來作弊欸
希望你今天下午數位期末考可以誠實考試呢
作弊游",不屬於你的學分就不該拿,2021-01-08T03:09:20.972Z,2021-01-08T03:09:20.972Z,12,6,M,ccu,https://www.dcard.tw/f/ccu/p/235134534,dcard,post,拜託你沒有唸書就不要想要靠別人來作弊欸希望你今天下午數位期末考可以誠實考試呢作弊游,"['拜託', '你', '沒有', '唸書', '就', '不要', '想要', '靠', '別人', '來', '作弊', '欸', '希望', '你', '今天', '下午', '數位', '期末考', '可以', '誠實', '考試', '呢', '作弊', '游']","['拜託', '唸書', '想要', '作弊', '欸', '希望', '今天', '下午', '數位', '期末考', '誠實', '考試', '作弊', '游']",[],negative
1,235130783,"大家好，先在此祝大家期末歐趴、考試順利
今天是想問問大家關於王秋玲老師的課程內容

我這學期修了王老師的職涯規劃，這是我第一次修王老師的課，一開始會選這堂課的原因不外乎大家都說好過，再加上爬了板上一些文章，大家對王老師的課普遍好評，想必是堂充實+好拿分的通識吧！

但是實際上課之後發現，老師上課時會有太多的語助詞，像是老師常常看著投影片然後發呆，過了幾秒才說了「嗯…好…OK…好的…大概是這樣」然後那張投影片就不講直接跳下一張！這讓我真的滿滿WTF，我們都還在等老師講投影片內容阿！這種情況大概一堂課會出現個兩三次，這倒還好，比較讓人難以接受的是老師會一直用OK、好的好的、嗯哼、額……之類大量的語助詞，讓我完全聽不懂老師想要表達的重點是什麼！(不過也有可能是我自己理解能力太差，我相信還是有人聽得懂的)。

然後還有老師會出現一個神奇的舉動，那就是「不知道講什麼」的情況，對，是真的不知道要講什麼，老師會突然停下來沈默好幾秒，然後自言自語說：「這部分我還要講嗎？」接著轉頭問助教：「這部分要不要講啊？」，我們在台下看的十分傻眼。感覺老師對自己的教材、投影片不熟，如果連老師你自己都不知道要不要講，那誰會知道= =，而且這種情況不是只有一次，而是一堂課裡反覆出現三、四次。

以上所講的事例讓我對王老師的課印象不是很好，上課體驗也很差，當然有人會說通識課不就是賺學分能過就好嗎？但我自己是希望能選到輕鬆的通識又能學到東西，抱歉，王老師的課我悟性不夠，沒辦法領會其中奧妙。真心希望王老師能好好準備上課內容，否則我接下來的兩年大學生涯即使缺學分也不會考慮王老師的課了(雖然老師也不差我一個學生啦haha)",問 王秋玲老師的課&內容,2021-01-07T11:08:40.923Z,2021-01-07T12:19:00.476Z,26,26,M,ccu,https://www.dcard.tw/f/ccu/p/235130783,dcard,post,大家好先在此祝大家期末歐趴考試順利今天是想問問大家關於王秋玲老師的課程內容我這學期修了王老師的職涯規劃這是我第一次修王老師的課一開始會選這堂課的原因不外乎大家都說好過再加上爬了板上一些文章大家對王老師的課普遍好評想必是堂充實好拿分的通識吧但是實際上課之後發現老師上課時會有太多的語助詞像是老師常常看著投影片然後發呆過了幾秒才說了嗯好好的大概是這樣然後那張投影片就不講直接跳下一張這讓我真的滿滿我們都還在等老師講投影片內容阿這種情況大概一堂課會出現個兩三次這倒還好比較讓人難以接受的是老師會一直用好的好的嗯哼額之類大量的語助詞讓我完全聽不懂老師想要表達的重點是什麼不過也有可能是我自己理解能力太差我相信還是有人聽得懂的然後還有老師會出現一個神奇的舉動那就是不知道講什麼的情況對是真的不知道要講什麼老師會突然停下來沈默好幾秒然後自言自語說這部分我還要講嗎接著轉頭問助教這部分要不要講啊我們在台下看的十分傻眼感覺老師對自己的教材投影片不熟如果連老師你自己都不知道要不要講那誰會知道而且這種情況不是只有一次而是一堂課裡反覆出現三四次以上所講的事例讓我對王老師的課印象不是很好上課體驗也很差當然有人會說通識課不就是賺學分能過就好嗎但我自己是希望能選到輕鬆的通識又能學到東西抱歉王老師的課我悟性不夠沒辦法領會其中奧妙真心希望王老師能好好準備上課內容否則我接下來的兩年大學生涯即使缺學分也不會考慮王老師的課了雖然老師也不差我一個學生啦,"['大家', '好', '先', '在', '此', '祝', '大家', '期末', '歐', '趴', '考試', '順利', '今天', '是', '想', '問問', '大家', '關於', '王秋玲', '老師', '的', '課程', '內容', '我', '這', '學期', '修', '了', '王', '老師', '的', '職涯', '規劃', '這', '是', '我', '第一', '次', '修', '王', '老師', '的', '課', '一', '開始', '會', '選', '這', '堂', '課', '的', '原因', '不外乎', '大家', '都', '說', '好過', '再', '加上', '爬', '了', '板', '上', '一些', '文章', '大家', '對', '王', '老師', '的', '課', '普遍', '好評', '想必', '是', '堂', '充實', '好拿分', '的', '通識', '吧', '但是', '實際', '上課', '之後', '發現', '老師', '上課', '時', '會', '有', '太多', '的', '語助詞', '像是', '老師', '常常', '看', '著', '投影片', '然後', '發呆', '過', '了', '幾', '秒', '才', '說', '了', '嗯', '好好', '的', '大概', '是', '這樣', '然後', '那', '張', '投影片', '就', '不', '講', '直接', '跳下', '一', '張', '這', '讓', '我', '真的', '滿滿', '我們', '都', '還', '在', '等', '老師', '講', '投影片', '內容', '阿', '這', '種', '情況', '大概', '一', '堂', '課', '會', '出現', '個', '兩三', '次', '這', '倒', '還好', '比較', '讓', '人', '難以', '接受', '的', '是', '老師', '會', '一直', '用', '好', '的', '好', '的', '嗯哼', '額', '之類', '大量', '的', '語助詞', '讓', '我', '完全', '聽', '不', '懂', '老師', '想要', '表達', '的', '重點', '是', '什麼', '不過', '也', '有', '可能', '是', '我', '自己', '理解', '能力', '太', '差', '我', '相信', '還是', '有', '人', '聽得懂', '的', '然後', '還', '有', '老師', '會', '出現', '一', '個', '神奇', '的', '舉動', '那', '就是', '不', '知道', '講', '什麼', '的', '情況', '對', '是', '真的', '不', '知道', '要', '講', '什麼', '老師', '會', '突然', '停下來', '沈默', '好幾', '秒', '然後', '自言自語', '說', '這', '部分', '我', '還要', '講', '嗎', '接著', '轉頭', '問', '分', '傻眼', '感覺', '老師', '對', '自己', '的', '教材', '投影片', '不', '熟', '如果', '連', '老師', '你', '自己', '都', '不', '知道', '要不要', '講', '那', '誰', '會', '知道', '而且', '這', '種', '情況', '不', '是', '只有', '一', '次', '而是', '一', '堂', '課', '裡', '反覆', '出現', '三四', '次', '以上', '所', '講', '的', '事例', '讓', '我', '對', '王', '老師', '的', '課', '印象', '不', '是', '很', '好', '上課', '體驗', '也', '很', '差', '當然', '有', '人', '會', '說', '通識課', '不', '就是', '賺', '學分', '能', '過', '就', '好', '嗎', '但', '我', '自己', '是', '希望', '能', '選到', '輕鬆', '的', '通識', '又', '能', '學到', '東西', '抱歉', '王', '老師', '的', '課', '我', '悟性', '不', '夠', '沒辦法', '領會', '其中', '奧妙', '真心', '希望', '王', '老師', '能', '好好', '準備', '上課', '內容', '否則', '我', '接下來', '的', '兩年', '大學', '生涯', '即使', '缺', '學分', '也', '不會', '考慮', '王', '老師', '的', '課', '了', '雖然', '老師', '也', '不', '差', '我', '一', '個', '學生', '啦']","['好', '先', '祝', '期末', '歐', '趴', '考試', '順利', '今天', '想', '問問', '王秋玲', '老師', '課程', '內容', '學期', '修', '王', '老師', '職涯', '規劃', '第一', '次', '修', '王', '老師', '課', '選', '堂', '課', '原因', '說', '好過', '再', '爬', '板', '一些', '文章', '王', '老師', '課', '普遍', '好評', '想必', '堂', '充實', '好拿分', '通識', '實際', '上課', '之後', '發現', '老師', '上課', '時', '太多', '語助詞', '像是', '老師', '投影片', '發呆', '秒', '說', '好好', '張', '投影片', '講', '直接', '跳下', '張', '真的', '滿滿', '老師', '講', '投影片', '內容', '種', '情況', '堂', '課', '出現', '兩三', '次', '倒', '還好', '比較', '人', '難以', '接受', '老師', '一直', '好', '好', '嗯哼', '額', '大量', '語助詞', '完全', '聽', '懂', '老師', '想要', '表達', '重點', '理解', '能力', '太', '差', '相信', '人', '聽得懂', '老師', '出現', '神奇', '舉動', '知道', '講', '情況', '真的', '知道', '講', '老師', '突然', '停下來', '沈默', '好幾', '秒', '自言自語', '說', '部分', '還要', '講', '轉頭', '問', '分', '傻眼', '感覺', '老師', '教材', '投影片', '熟', '老師', '知道', '要不要', '講', '知道', '種', '情況', '次', '堂', '課', '裡', '反覆', '出現', '三四', '次', '以上', '講', '事例', '王', '老師', '課', '印象', '好', '上課', '體驗', '差', '人', '說', '通識課', '賺', '學分', '好', '希望', '選到', '輕鬆', '通識', '學到', '東西', '抱歉', '王', '老師', '課', '悟性', '夠', '沒辦法', '領會', '奧妙', '真心', '希望', '王', '老師', '好好', '準備', '上課', '內容', '兩年', '大學', '生涯', '缺', '學分', '考慮', '王', '老師', '課', '老師', '差', '學生']","['老師', '課', '王']",positive
2,235130608,"某：欸走啊去修今日化工，他是涼課

我：對阿，分數真的涼





死去的涼",今日化工涼課,2021-01-07T10:37:27.406Z,2021-01-07T10:37:27.406Z,14,15,M,ccu,https://www.dcard.tw/f/ccu/p/235130608,dcard,post,某欸走啊去修今日化工他是涼課我對阿分數真的涼死去的涼,"['某', '欸', '走', '啊', '去', '修', '今日', '化工', '他', '是', '涼課', '我', '對', '阿', '分數', '真的', '涼', '死去', '的', '涼']","['欸', '走', '修', '今日', '化工', '涼課', '分數', '真的', '涼', '死去', '涼']",[],neutral
3,235130158,"范崇碩老師不知道你會不會看到
我愛你
真的你是最棒的老師
你的笑話超好笑但我很對不起你我都沒捧場
我以後只要能修你的課我一定修爆
你超帥",告白,2021-01-07T09:15:33.849Z,2021-01-07T09:15:33.849Z,12,19,F,ccu,https://www.dcard.tw/f/ccu/p/235130158,dcard,post,范崇碩老師不知道你會不會看到我愛你真的你是最棒的老師你的笑話超好笑但我很對不起你我都沒捧場我以後只要能修你的課我一定修爆你超帥,"['范崇碩', '老師', '不', '知道', '你', '會不會', '看到', '我', '愛', '你', '真的', '你', '是', '最', '棒', '的', '老師', '你', '的', '笑話', '超', '好笑', '但', '我', '很', '對不起', '你我', '都', '沒', '捧場', '我', '以後', '只要', '能', '修', '你', '的', '課', '我', '一定', '修爆', '你', '超', '帥']","['范崇碩', '老師', '知道', '會不會', '看到', '愛', '真的', '最', '棒', '老師', '笑話', '超', '好笑', '對不起', '你我', '捧場', '以後', '修', '課', '一定', '修爆', '超', '帥']",[],positive
4,235129606,"你在走路 移椅子 開紗窗 樓下都聽得到
現在一直蹦蹦蹦也聽得到
可以有點公德心嗎",住D棟308的人可以小聲一點嗎,2021-01-07T07:36:42.978Z,2021-01-07T07:36:42.978Z,7,1,F,ccu,https://www.dcard.tw/f/ccu/p/235129606,dcard,post,你在走路移椅子開紗窗樓下都聽得到現在一直蹦蹦蹦也聽得到可以有點公德心嗎,"['你', '在', '走路', '移', '椅子', '開', '紗窗', '樓下', '都', '聽得到', '現在', '一直', '蹦', '蹦蹦', '也', '聽得到', '可以', '有點', '公德心', '嗎']","['走路', '移', '椅子', '開', '紗窗', '樓下', '聽得到', '現在', '一直', '蹦', '蹦蹦', '聽得到', '有點', '公德心']",[],neutral
5,235129170,如題，本鲁剛入坑，很喜歡和克蘇魯有關的 東西，也想和人玩桌遊跑團，想看看有沒有在中正的同好， 謝謝🙏,有人喜歡克蘇魯嗎？,2021-01-07T06:14:34.977Z,2021-01-07T06:14:34.977Z,4,1,M,ccu,https://www.dcard.tw/f/ccu/p/235129170,dcard,post,如題本鲁剛入坑很喜歡和克蘇魯有關的東西也想和人玩桌遊跑團想看看有沒有在中正的同好謝謝,,[],[],neutral
6,235129006,想問有沒有住書香的覺得最近幾個月網路變很慢，看影片都會卡🤔,書香網路,2021-01-07T05:42:21.764Z,2021-01-07T05:42:21.764Z,5,3,M,ccu,https://www.dcard.tw/f/ccu/p/235129006,dcard,post,想問有沒有住書香的覺得最近幾個月網路變很慢看影片都會卡,"['想', '問', '有沒有', '住', '書香', '的', '覺得', '最近', '幾', '個', '月', '網路', '變', '很', '慢', '看', '影片', '都', '會', '卡']","['想', '問', '有沒有', '住', '書香', '覺得', '最近', '月', '網路', '變', '慢', '影片', '卡']",[],neutral
7,235128629,"今天早上圖書館7樓借討論室的人音量有點大聲喔
請注意一下，圖書館的隔音真的不太好
還有人要讀書，尊重一下吧",討論室請注意音量,2021-01-07T04:29:55.816Z,2021-01-07T04:31:01.572Z,13,6,M,ccu,https://www.dcard.tw/f/ccu/p/235128629,dcard,post,今天早上圖書館樓借討論室的人音量有點大聲喔請注意一下圖書館的隔音真的不太好還有人要讀書尊重一下吧,"['今天', '早上', '圖書館', '樓借', '討論室', '的', '人', '音量', '有點', '大聲', '喔', '請', '注意', '一下', '圖書館', '的', '隔音', '真的', '不', '太', '好', '還', '有', '人', '要', '讀書', '尊重', '一下', '吧']","['今天', '早上', '圖書館', '樓借', '討論室', '人', '音量', '有點', '大聲', '請', '注意', '一下', '圖書館', '隔音', '真的', '太', '好', '人', '讀書', '尊重', '一下']",[],positive
